DICT,EX,ID,LIST,REG
"{'Description': 'Edit Of A Group Policy Object A directory service object was modified. Subject:  Security ID:  ACME-FR\\Administrator Account Name:  Administrator Account Domain:  ACME-FR Logon ID:  0xc84dfe Directory Service:  Name: acme.com Type: Active Directory Domain Services Object:  DN: cn={0AB54C97-8836-43BB-9B53- 87556DD51F30},cn=policies,cn=system,DC=acme,DC=com GUID: CN={0AB54C97-8836-43BB-9B53- 87556DD51F30},CN=Policies,CN=System,DC=acme,DC=com Class: groupPolicyContainer Attribute:  LDAP Display Name: versionNumber Syntax (OID): 2.5.5.9 Value: 4 Operation:  Type: Value Added Correlation ID: {ff320a1e-447a-4bb1-9196-bb3469a00b55} Application Correlation ID: - ------------------------------------------------ Change To Display Name Of User A directory service object was modified. Subject:  Security ID:  ACME\\administrator Account Name:  administrator Account Domain:  ACME Logon ID:  0x30999 Directory Service:  Name: acme.com Type: Active Directory Domain Services  Object:  DN: cn=Evangeline Lilly,ou=test,DC=acme,DC=com GUID: CN=Evangeline Lilly,OU=test,DC=acme,DC=com Class: user Attribute:  LDAP Display Name: displayName Syntax (OID): 2.5.5.12 Value: Born to run character in Lost Operation:  Type: Value Added Correlation ID: {c0313036-edda-4f26-bdbf-a43c6013e7e3} Application Correlation ID: - ------------------------------------------------ Change To Permissions on an OU A directory service object was', 'Description2': 'modified.', 'SubjectSID': 'ACME\\administrator', 'SubjectAccountName': 'Administrator', 'SubjectAccountDomain': 'ACME', 'SubjectLogonID': '0x23187', 'DirectoryServiceName': 'acme.com', 'DirectoryServiceType': 'Active Directory Domain Services ', 'ObjectDN': 'OU=AcmeManagers,OU=AcmeAdmins,DC-acme,DC=ru', 'ObjectGUID': '{ae01e035-e108-4108-a098-1a3162ebe245}', 'ObjectClass': 'organizationalUnit', 'AttributeLDAPDisplayName': 'nTSecurityDescriptor', 'AttributeSyntaxOID': '2.5.5.15', 'AttributeValue': 'O:DAG:DAD:AI(OA;CIIO;CR;00299570-246d-11d0-a768-00aa006e0529;bf967aba-0de6-11d0-a285-00aa003049e2;S-1-5-21-3574173841-1192904138-508017755-1000)(OA;CIIO;RPWP;bf967a0a-0de6-11d0-a285-00aa003049e2;bf967aba-0de6-11d0-a285-00aa003049e2;S-1-5-21-3574173841-1192904138-508017755-1000)(OA;;CCDC;4828cc14-1437-45bc-9b07-ad6f015e5f28;;AO)(OA;;CCDC;bf967a86-0de6-11d0-a285-00aa003049e2;;AO)(OA;;CCDC;bf967a9c-0de6-11d0-a285-00aa003049e2;;AO)(OA;;CCDC;bf967aa8-0de6-11d0-a285-00aa003049e2;;PO)(OA;;CCDC;bf967aba-0de6-11d0-a285-00aa003049e2;;AO)(A;;CCDCLCSWRPWPDTLOCRSDRCWDWO;;;DA)(A;;LCRPLORC;;;ED)(A;;LCRPLORC;;;AU)(A;;CCDCLCSWRPWPDTLOCRSDRCWDWO;;;SY)(OA;CIIOID;RP;4c164200-20c0-11d0-a768-00aa006e0529;4828cc14-1437-45bc-9b07-ad6f015e5f28;RU)(OA;CIIOID;RP;4c164200-20c0-11d0-a768-00aa006e0529;bf967aba-0de6-11d0-a285-00aa003049e2;RU)(OA;CIIOID;RP;5f202010-79a5-11d0-9020-', 'OperationType': 'Value Added', 'OperationCorrelationID': '{dfc8f4d7-b08c-492f-9686-99de30e1a7d1}', 'OperationApplicationCorrelationID': '- '}","Edit Of A Group Policy Object A directory service object was modified. Subject:  Security ID:  ACME-FR\Administrator Account Name:  Administrator Account Domain:  ACME-FR Logon ID:  0xc84dfe Directory Service:  Name: acme.com Type: Active Directory Domain Services Object:  DN: cn={0AB54C97-8836-43BB-9B53- 87556DD51F30},cn=policies,cn=system,DC=acme,DC=com GUID: CN={0AB54C97-8836-43BB-9B53- 87556DD51F30},CN=Policies,CN=System,DC=acme,DC=com Class: groupPolicyContainer Attribute:  LDAP Display Name: versionNumber Syntax (OID): 2.5.5.9 Value: 4 Operation:  Type: Value Added Correlation ID: {ff320a1e-447a-4bb1-9196-bb3469a00b55} Application Correlation ID: - ------------------------------------------------ Change To Display Name Of User A directory service object was modified. Subject:  Security ID:  ACME\administrator Account Name:  administrator Account Domain:  ACME Logon ID:  0x30999 Directory Service:  Name: acme.com Type: Active Directory Domain Services  Object:  DN: cn=Evangeline Lilly,ou=test,DC=acme,DC=com GUID: CN=Evangeline Lilly,OU=test,DC=acme,DC=com Class: user Attribute:  LDAP Display Name: displayName Syntax (OID): 2.5.5.12 Value: Born to run character in Lost Operation:  Type: Value Added Correlation ID: {c0313036-edda-4f26-bdbf-a43c6013e7e3} Application Correlation ID: - ------------------------------------------------ Change To Permissions on an OU A directory service object was modified. Subject:  Security ID:  ACME\administrator Account Name: Administrator Account Domain:  ACME Logon ID:  0x23187 Directory Service:  Name: acme.com Type: Active Directory Domain Services  Object:  DN: OU=AcmeManagers,OU=AcmeAdmins,DC-acme,DC=ru GUID: {ae01e035-e108-4108-a098-1a3162ebe245} Class: organizationalUnit Attribute:  LDAP Display Name: nTSecurityDescriptor Syntax (OID): 2.5.5.15 Value: O:DAG:DAD:AI(OA;CIIO;CR;00299570-246d-11d0-a768-00aa006e0529;bf967aba-0de6-11d0-a285-00aa003049e2;S-1-5-21-3574173841-1192904138-508017755-1000)(OA;CIIO;RPWP;bf967a0a-0de6-11d0-a285-00aa003049e2;bf967aba-0de6-11d0-a285-00aa003049e2;S-1-5-21-3574173841-1192904138-508017755-1000)(OA;;CCDC;4828cc14-1437-45bc-9b07-ad6f015e5f28;;AO)(OA;;CCDC;bf967a86-0de6-11d0-a285-00aa003049e2;;AO)(OA;;CCDC;bf967a9c-0de6-11d0-a285-00aa003049e2;;AO)(OA;;CCDC;bf967aa8-0de6-11d0-a285-00aa003049e2;;PO)(OA;;CCDC;bf967aba-0de6-11d0-a285-00aa003049e2;;AO)(A;;CCDCLCSWRPWPDTLOCRSDRCWDWO;;;DA)(A;;LCRPLORC;;;ED)(A;;LCRPLORC;;;AU)(A;;CCDCLCSWRPWPDTLOCRSDRCWDWO;;;SY)(OA;CIIOID;RP;4c164200-20c0-11d0-a768-00aa006e0529;4828cc14-1437-45bc-9b07-ad6f015e5f28;RU)(OA;CIIOID;RP;4c164200-20c0-11d0-a768-00aa006e0529;bf967aba-0de6-11d0-a285-00aa003049e2;RU)(OA;CIIOID;RP;5f202010-79a5-11d0-9020- Operation:  Type: Value Added Correlation ID: {dfc8f4d7-b08c-492f-9686-99de30e1a7d1} Application Correlation ID: - ",5136,"['Edit Of A Group Policy Object', 'A directory service object was modified.', 'Subject:', ' Security ID:  ACME-FR\\\\\\\\\\\\\\\\\\\\\\\\\\\\\\\\Administrator', 'Account Name:  Administrator', 'Account Domain:  ACME-FR', 'Logon ID:  0xc84dfe', 'Directory Service:', ' Name: acme.com', 'Type: Active Directory Domain Services', 'Object:', ' DN: cn={0AB54C97-8836-43BB-9B53- 87556DD51F30},cn=policies,cn=system,DC=acme,DC=com', 'GUID: CN={0AB54C97-8836-43BB-9B53- 87556DD51F30},CN=Policies,CN=System,DC=acme,DC=com', 'Class: groupPolicyContainer', 'Attribute:', ' LDAP Display Name: versionNumber', 'Syntax (OID): 2.5.5.9', 'Value: 4', 'Operation:', ' Type: Value Added', 'Correlation ID: {ff320a1e-447a-4bb1-9196-bb3469a00b55}', 'Application Correlation ID: -']",(?P<Description>.*)\s+(?P<Description2>.*)\s+Subject:(?:\s+|\S) Security ID:(?:\s+|\S)(?P<SubjectSID>.*)\s+Account Name:(?:\s+|\S)(?P<SubjectAccountName>.*)\s+Account Domain:(?:\s+|\S)(?P<SubjectAccountDomain>.*)\s+Logon ID:(?:\s+|\S)(?P<SubjectLogonID>.*)\s+Directory Service:(?:\s+|\S) Name:(?:\s+|\S)(?P<DirectoryServiceName>.*)\s+Type:(?:\s+|\S)(?P<DirectoryServiceType>.*)\s+Object:(?:\s+|\S) DN:(?:\s+|\S)(?P<ObjectDN>.*)\s+GUID:(?:\s+|\S)(?P<ObjectGUID>.*)\s+Class:(?:\s+|\S)(?P<ObjectClass>.*)\s+Attribute:(?:\s+|\S) LDAP Display Name:(?:\s+|\S)(?P<AttributeLDAPDisplayName>.*)\s+Syntax \(OID\):(?:\s+|\S)(?P<AttributeSyntaxOID>.*)\s+Value:(?:\s+|\S)(?P<AttributeValue>.*)\s+Operation:(?:\s+|\S) Type:(?:\s+|\S)(?P<OperationType>.*)\s+Correlation ID:(?:\s+|\S)(?P<OperationCorrelationID>.*)\s+Application Correlation ID:(?:\s+|\S)(?P<OperationApplicationCorrelationID>.*)
"{'Description': 'Creation of a User A directory service object was created. Subject:  Security ID:  ACME\\Administrator Account Name:  Administrator Account Domain:  ACME Logon ID:  0x27a79 Directory Service:  Name: acme.local Type: Active Directory Domain Services Object:  DN: cn=Nimrod Jones,OU=New York,OU=AcmeUsers,DC=acme,DC=local GUID: CN=Nimrod Jones\\0ADEL:24f60da0-baeb-4e6c-99f1- 8fdad6a39515,CN=Deleted Objects,DC=acme,DC=local Class: user Operation:  Correlation ID: {60818a5a-4bdb-4c72-bcd2-7e54ba21b25e} Application Correlation ID: - ---------------------------------------------------- Creation of a Group Policy Object A directory service object was', 'Description2': 'created.', 'SubjectSID': 'ACME\\administrator', 'SubjectAccountName': 'administrator', 'SubjectAccountDomain': 'ACME', 'SubjectLogonID': '0x30999', 'DirectoryServiceName': 'acme.com', 'DirectoryServiceType': 'Active Directory Domain Services', 'ObjectDN': 'CN={8F8DF4A9-5B21-4A27-9BA6- 1AECC663E843},CN=Policies,CN=System,DC=acme,DC=com', 'ObjectGUID': 'CN={8F8DF4A9-5B21-4A27-9BA6-1AECC663E843}\\0ADEL:291d5001- 782a-4b3c-a319-87c060621b0e,CN=Deleted Objects,DC=acme,DC=com', 'ObjectClass': 'groupPolicyContainer', 'OperationCorrelationID': '{f4435860-98a6-4846-9cbb-3a43b117333e}', 'OperationApplicationCorrelationID': '- '}","Creation of a User A directory service object was created. Subject:  Security ID:  ACME\Administrator Account Name:  Administrator Account Domain:  ACME Logon ID:  0x27a79 Directory Service:  Name: acme.local Type: Active Directory Domain Services Object:  DN: cn=Nimrod Jones,OU=New York,OU=AcmeUsers,DC=acme,DC=local GUID: CN=Nimrod Jones\0ADEL:24f60da0-baeb-4e6c-99f1- 8fdad6a39515,CN=Deleted Objects,DC=acme,DC=local Class: user Operation:  Correlation ID: {60818a5a-4bdb-4c72-bcd2-7e54ba21b25e} Application Correlation ID: - ---------------------------------------------------- Creation of a Group Policy Object A directory service object was created. Subject:  Security ID:  ACME\administrator Account Name:  administrator Account Domain:  ACME Logon ID:  0x30999 Directory Service:  Name: acme.com Type: Active Directory Domain Services Object:  DN: CN={8F8DF4A9-5B21-4A27-9BA6- 1AECC663E843},CN=Policies,CN=System,DC=acme,DC=com GUID: CN={8F8DF4A9-5B21-4A27-9BA6-1AECC663E843}\0ADEL:291d5001- 782a-4b3c-a319-87c060621b0e,CN=Deleted Objects,DC=acme,DC=com Class: groupPolicyContainer Operation:  Correlation ID: {f4435860-98a6-4846-9cbb-3a43b117333e} Application Correlation ID: - ",5137,"['Creation of a User', 'A directory service object was created.', 'Subject:', ' Security ID:  ACME\\\\\\\\\\\\\\\\\\\\\\\\\\\\\\\\Administrator', 'Account Name:  Administrator', 'Account Domain:  ACME', 'Logon ID:  0x27a79', 'Directory Service:', ' Name: acme.local', 'Type: Active Directory Domain Services', 'Object:', ' DN: cn=Nimrod Jones,OU=New York,OU=AcmeUsers,DC=acme,DC=local', 'GUID: CN=Nimrod Jones\\\\\\\\\\\\\\\\\\\\\\\\\\\\\\\\0ADEL:24f60da0-baeb-4e6c-99f1- 8fdad6a39515,CN=Deleted Objects,DC=acme,DC=local', 'Class: user', 'Operation:', ' Correlation ID: {60818a5a-4bdb-4c72-bcd2-7e54ba21b25e}', 'Application Correlation ID: -']",(?P<Description>.*)\s+(?P<Description2>.*)\s+Subject:(?:\s+|\S) Security ID:(?:\s+|\S)(?P<SubjectSID>.*)\s+Account Name:(?:\s+|\S)(?P<SubjectAccountName>.*)\s+Account Domain:(?:\s+|\S)(?P<SubjectAccountDomain>.*)\s+Logon ID:(?:\s+|\S)(?P<SubjectLogonID>.*)\s+Directory Service:(?:\s+|\S) Name:(?:\s+|\S)(?P<DirectoryServiceName>.*)\s+Type:(?:\s+|\S)(?P<DirectoryServiceType>.*)\s+Object:(?:\s+|\S) DN:(?:\s+|\S)(?P<ObjectDN>.*)\s+GUID:(?:\s+|\S)(?P<ObjectGUID>.*)\s+Class:(?:\s+|\S)(?P<ObjectClass>.*)\s+Operation:(?:\s+|\S) Correlation ID:(?:\s+|\S)(?P<OperationCorrelationID>.*)\s+Application Correlation ID:(?:\s+|\S)(?P<OperationApplicationCorrelationID>.*)
"{'Description': 'A directory service object was undeleted.', 'SubjectSID': '%3', 'SubjectAccountName': '%4', 'SubjectAccountDomain': '%5', 'SubjectLogonID': '%6', 'DirectoryServiceName': '%7', 'DirectoryServiceType': '%8', 'ObjectOldDN': '%9', 'ObjectNewDN': '%10', 'ObjectGUID': '%11', 'ObjectClass': '%12', 'OperationCorrelationID': '%1', 'OperationApplicationCorrelationID': '%2 '}",A directory service object was undeleted. Subject:  Security ID:  %3 Account Name:  %4 Account Domain:  %5 Logon ID:  %6 Directory Service:  Name: %7 Type: %8 Object:  Old DN: %9 New DN: %10 GUID: %11 Class: %12 Operation:  Correlation ID: %1 Application Correlation ID: %2 ,5138,"['A directory service object was undeleted.', 'Subject:', ' Security ID:  %3', 'Account Name:  %4', 'Account Domain:  %5', 'Logon ID:  %6', 'Directory Service:', ' Name: %7', 'Type: %8', 'Object:', ' Old DN: %9', 'New DN: %10', 'GUID: %11', 'Class: %12', 'Operation:', ' Correlation ID: %1', 'Application Correlation ID: %2']",(?P<Description>.*)\s+Subject:(?:\s+|\S) Security ID:(?:\s+|\S)(?P<SubjectSID>.*)\s+Account Name:(?:\s+|\S)(?P<SubjectAccountName>.*)\s+Account Domain:(?:\s+|\S)(?P<SubjectAccountDomain>.*)\s+Logon ID:(?:\s+|\S)(?P<SubjectLogonID>.*)\s+Directory Service:(?:\s+|\S) Name:(?:\s+|\S)(?P<DirectoryServiceName>.*)\s+Type:(?:\s+|\S)(?P<DirectoryServiceType>.*)\s+Object:(?:\s+|\S) Old DN:(?:\s+|\S)(?P<ObjectOldDN>.*)\s+New DN:(?:\s+|\S)(?P<ObjectNewDN>.*)\s+GUID:(?:\s+|\S)(?P<ObjectGUID>.*)\s+Class:(?:\s+|\S)(?P<ObjectClass>.*)\s+Operation:(?:\s+|\S) Correlation ID:(?:\s+|\S)(?P<OperationCorrelationID>.*)\s+Application Correlation ID:(?:\s+|\S)(?P<OperationApplicationCorrelationID>.*)
"{'Description': 'A directory service object was moved.', 'SubjectSID': 'ACME\\Administrator', 'SubjectAccountName': 'Administrator', 'SubjectAccountDomain': 'ACME', 'SubjectLogonID': '0x27a79', 'DirectoryServiceName': 'acme.local', 'DirectoryServiceType': 'Active Directory Domain Services', 'ObjectOldDN': 'CN=Napoleon Bonaparte,OU=New York,OU=AcmeUsers,DC=acme,DC=local', 'ObjectNewDN': 'CN=Napoleon Bonaparte,OU=France,OU=AcmeUsers,DC=acme,DC=local', 'ObjectGUID': 'CN=Napoleon Bonaparte,OU=France,OU=AcmeUsers,DC=acme,DC=local', 'ObjectClass': 'user', 'OperationCorrelationID': '{03012d56-855d-41ed-84ac-ec11979965d0}', 'OperationApplicationCorrelationID': '- '}","A directory service object was moved. Subject:  Security ID:  ACME\Administrator Account Name:  Administrator Account Domain:  ACME Logon ID:  0x27a79 Directory Service:  Name:  acme.local Type:  Active Directory Domain Services Object:  Old DN:  CN=Napoleon Bonaparte,OU=New York,OU=AcmeUsers,DC=acme,DC=local New DN: CN=Napoleon Bonaparte,OU=France,OU=AcmeUsers,DC=acme,DC=local GUID:  CN=Napoleon Bonaparte,OU=France,OU=AcmeUsers,DC=acme,DC=local Class:  user Operation:  Correlation ID:  {03012d56-855d-41ed-84ac-ec11979965d0} Application Correlation ID: - ",5139,"['A directory service object was moved.', 'Subject:', ' Security ID:  ACME\\\\\\\\\\\\\\\\\\\\\\\\\\\\\\\\Administrator', 'Account Name:  Administrator', 'Account Domain:  ACME', 'Logon ID:  0x27a79', 'Directory Service:', ' Name:  acme.local', 'Type:  Active Directory Domain Services', 'Object:', ' Old DN:  CN=Napoleon Bonaparte,OU=New York,OU=AcmeUsers,DC=acme,DC=local', 'New DN: CN=Napoleon Bonaparte,OU=France,OU=AcmeUsers,DC=acme,DC=local', 'GUID:  CN=Napoleon Bonaparte,OU=France,OU=AcmeUsers,DC=acme,DC=local', 'Class:  user', 'Operation:', ' Correlation ID:  {03012d56-855d-41ed-84ac-ec11979965d0}', 'Application Correlation ID: -']",(?P<Description>.*)\s+Subject:(?:\s+|\S) Security ID:(?:\s+|\S)(?P<SubjectSID>.*)\s+Account Name:(?:\s+|\S)(?P<SubjectAccountName>.*)\s+Account Domain:(?:\s+|\S)(?P<SubjectAccountDomain>.*)\s+Logon ID:(?:\s+|\S)(?P<SubjectLogonID>.*)\s+Directory Service:(?:\s+|\S) Name:(?:\s+|\S)(?P<DirectoryServiceName>.*)\s+Type:(?:\s+|\S)(?P<DirectoryServiceType>.*)\s+Object:(?:\s+|\S) Old DN:(?:\s+|\S)(?P<ObjectOldDN>.*)\s+New DN:(?:\s+|\S)(?P<ObjectNewDN>.*)\s+GUID:(?:\s+|\S)(?P<ObjectGUID>.*)\s+Class:(?:\s+|\S)(?P<ObjectClass>.*)\s+Operation:(?:\s+|\S) Correlation ID:(?:\s+|\S)(?P<OperationCorrelationID>.*)\s+Application Correlation ID:(?:\s+|\S)(?P<OperationApplicationCorrelationID>.*)
"{'Description': 'A network share object was accessed.', 'SubjectSID': 'ACME-FR\\Administrator', 'SubjectAccountName': 'Administrator', 'SubjectAccountDomain': 'ACME-FR', 'SubjectLogonID': '0x74a739', 'NetworkInformationSourceAddress': '10.42.42.221', 'NetworkInformationSourcePort': '65097', 'NetworkInformationShareName': '\\\\*\\Dharma Initiative Protocols '}",A network share object was accessed. Subject:  Security ID:  ACME-FR\Administrator Account Name:  Administrator Account Domain:  ACME-FR Logon ID:  0x74a739 Network Information:  Source Address:  10.42.42.221 Source Port:  65097 Share Name:  \\*\Dharma Initiative Protocols ,5140,"['A network share object was accessed.', 'Subject:', ' Security ID:  ACME-FR\\\\\\\\\\\\\\\\\\\\\\\\\\\\\\\\Administrator', 'Account Name:  Administrator', 'Account Domain:  ACME-FR', 'Logon ID:  0x74a739', 'Network Information:', ' Source Address:  10.42.42.221', 'Source Port:  65097', 'Share Name:  \\\\\\\\\\\\\\\\\\\\\\\\\\\\\\\\\\\\\\\\\\\\\\\\\\\\\\\\\\\\\\\\*\\\\\\\\\\\\\\\\\\\\\\\\\\\\\\\\Dharma Initiative Protocols']",(?P<Description>.*)\s+Subject:(?:\s+|\S) Security ID:(?:\s+|\S)(?P<SubjectSID>.*)\s+Account Name:(?:\s+|\S)(?P<SubjectAccountName>.*)\s+Account Domain:(?:\s+|\S)(?P<SubjectAccountDomain>.*)\s+Logon ID:(?:\s+|\S)(?P<SubjectLogonID>.*)\s+Network Information:(?:\s+|\S) Source Address:(?:\s+|\S)(?P<NetworkInformationSourceAddress>.*)\s+Source Port:(?:\s+|\S)(?P<NetworkInformationSourcePort>.*)\s+Share Name:(?:\s+|\S)(?P<NetworkInformationShareName>.*)
"{'Description': 'A directory service object was deleted.', 'SubjectSID': 'ACME\\administrator', 'SubjectAccountName': 'administrator', 'SubjectAccountDomain': 'ACME', 'SubjectLogonID': '0x30999', 'DirectoryServiceName': 'acme.com', 'DirectoryServiceType': 'Active Directory Domain Services', 'ObjectDN': 'CN={8F8DF4A9-5B21-4A27-9BA6- 1AECC663E843},CN=Policies,CN=System,DC=acme,DC=com', 'ObjectGUID': 'CN={8F8DF4A9-5B21-4A27-9BA6-1AECC663E843}\\0ADEL:291d5001- 782a-4b3c-a319-87c060621b0e,CN=Deleted Objects,DC=acme,DC=com', 'ObjectClass': 'groupPolicyContainer', 'OperationTreeDelete': 'No', 'OperationCorrelationID': '{140c9cef-8dc1-48f4-8b4a-de79230731a6}', 'OperationApplicationCorrelationID': '-  '}","A directory service object was deleted. Subject:  Security ID:  ACME\administrator Account Name:  administrator Account Domain:  ACME Logon ID:  0x30999 Directory Service:  Name: acme.com Type: Active Directory Domain Services Object:  DN: CN={8F8DF4A9-5B21-4A27-9BA6- 1AECC663E843},CN=Policies,CN=System,DC=acme,DC=com GUID: CN={8F8DF4A9-5B21-4A27-9BA6-1AECC663E843}\0ADEL:291d5001- 782a-4b3c-a319-87c060621b0e,CN=Deleted Objects,DC=acme,DC=com Class: groupPolicyContainer Operation:  Tree Delete: No Correlation ID: {140c9cef-8dc1-48f4-8b4a-de79230731a6} Application Correlation ID: -  ",5141,"['A directory service object was deleted.', 'Subject:', ' Security ID:  ACME\\\\\\\\\\\\\\\\\\\\\\\\\\\\\\\\administrator', 'Account Name:  administrator', 'Account Domain:  ACME', 'Logon ID:  0x30999', 'Directory Service:', ' Name: acme.com', 'Type: Active Directory Domain Services', 'Object:', ' DN: CN={8F8DF4A9-5B21-4A27-9BA6- 1AECC663E843},CN=Policies,CN=System,DC=acme,DC=com', 'GUID: CN={8F8DF4A9-5B21-4A27-9BA6-1AECC663E843}\\\\\\\\\\\\\\\\\\\\\\\\\\\\\\\\0ADEL:291d5001- 782a-4b3c-a319-87c060621b0e,CN=Deleted Objects,DC=acme,DC=com', 'Class: groupPolicyContainer', 'Operation:', ' Tree Delete: No', 'Correlation ID: {140c9cef-8dc1-48f4-8b4a-de79230731a6}', 'Application Correlation ID: -']",(?P<Description>.*)\s+Subject:(?:\s+|\S) Security ID:(?:\s+|\S)(?P<SubjectSID>.*)\s+Account Name:(?:\s+|\S)(?P<SubjectAccountName>.*)\s+Account Domain:(?:\s+|\S)(?P<SubjectAccountDomain>.*)\s+Logon ID:(?:\s+|\S)(?P<SubjectLogonID>.*)\s+Directory Service:(?:\s+|\S) Name:(?:\s+|\S)(?P<DirectoryServiceName>.*)\s+Type:(?:\s+|\S)(?P<DirectoryServiceType>.*)\s+Object:(?:\s+|\S) DN:(?:\s+|\S)(?P<ObjectDN>.*)\s+GUID:(?:\s+|\S)(?P<ObjectGUID>.*)\s+Class:(?:\s+|\S)(?P<ObjectClass>.*)\s+Operation:(?:\s+|\S) Tree Delete:(?:\s+|\S)(?P<OperationTreeDelete>.*)\s+Correlation ID:(?:\s+|\S)(?P<OperationCorrelationID>.*)\s+Application Correlation ID:(?:\s+|\S)(?P<OperationApplicationCorrelationID>.*)
"{'Description': 'A network share object was added. ', 'SubjectSID': 'W8R2\\wsmith', 'SubjectAccountName': 'wsmith', 'SubjectAccountDomain': 'W8R2', 'SubjectLogonID': '0x475b7', 'SubjectShareInformation': '', 'SubjectShareName': '\\\\*\\AcmeAccounting', 'SubjectSharePath': 'C:\\AcmeAccounting '}",A network share object was added.  Subject: Security ID: W8R2\wsmith Account Name: wsmith Account Domain: W8R2 Logon ID: 0x475b7 Share Information:  Share Name: \\*\AcmeAccounting Share Path: C:\AcmeAccounting ,5142,"['A network share object was added.', 'Subject:', 'Security ID: W8R2\\\\\\\\\\\\\\\\\\\\\\\\\\\\\\\\wsmith', 'Account Name: wsmith', 'Account Domain: W8R2', 'Logon ID: 0x475b7', 'Share Information: ', 'Share Name: \\\\\\\\\\\\\\\\\\\\\\\\\\\\\\\\\\\\\\\\\\\\\\\\\\\\\\\\\\\\\\\\*\\\\\\\\\\\\\\\\\\\\\\\\\\\\\\\\AcmeAccounting', 'Share Path: C:\\\\\\\\\\\\\\\\\\\\\\\\\\\\\\\\AcmeAccounting']",(?P<Description>.*)\s+Subject:(?:\s+|\S)Security ID:(?:\s+|\S)(?P<SubjectSID>.*)\s+Account Name:(?:\s+|\S)(?P<SubjectAccountName>.*)\s+Account Domain:(?:\s+|\S)(?P<SubjectAccountDomain>.*)\s+Logon ID:(?:\s+|\S)(?P<SubjectLogonID>.*)\s+Share Information:(?:\s+|\S)(?P<SubjectShareInformation>.*)\s+Share Name:(?:\s+|\S)(?P<SubjectShareName>.*)\s+Share Path:(?:\s+|\S)(?P<SubjectSharePath>.*)
"{'Description': 'A network share object was modified. ', 'SubjectSID': 'W8R2\\wsmith', 'SubjectAccountName': 'wsmith', 'SubjectAccountDomain': 'W8R2', 'SubjectLogonID': '0x475b7', 'ShareInformationObjectType': 'Directory', 'ShareInformationShareName': '\\\\*\\AcmeAccounting', 'ShareInformationSharePath': 'C:\\AcmeAccounting', 'ShareInformationOldRemark': 'N/A', 'ShareInformationNewRemark': 'N/A', 'ShareInformationOldMaxUsers': '0xffffffff', 'ShareInformationNewMaxusers': '0xffffffff', 'ShareInformationOldShareFlags': '0x0', 'ShareInformationNewShareFlags': '0x800', 'ShareInformationOldSD': 'O:S-1-5-21-1850286605-2959700293-454930584-1104G:DUD:(A;OICI;FA;;;BA)(A;OICI;FA;;;WD)', 'ShareInformationNewSD': 'O:S-1-5-21-1850286605-2959700293-454930584-1104G:DUD:(A;OICI;FA;;;BA)(A;OICI;FA;;;WD) '}",A network share object was modified.  Subject: Security ID: W8R2\wsmith Account Name: wsmith Account Domain: W8R2 Logon ID: 0x475b7 Share Information: Object Type: Directory Share Name: \\*\AcmeAccounting Share Path: C:\AcmeAccounting Old Remark: N/A New Remark: N/A Old MaxUsers: 0xffffffff New Maxusers: 0xffffffff Old ShareFlags: 0x0 New ShareFlags: 0x800 Old SD: O:S-1-5-21-1850286605-2959700293-454930584-1104G:DUD:(A;OICI;FA;;;BA)(A;OICI;FA;;;WD) New SD: O:S-1-5-21-1850286605-2959700293-454930584-1104G:DUD:(A;OICI;FA;;;BA)(A;OICI;FA;;;WD) ,5143,"['A network share object was modified.', 'Subject:', 'Security ID: W8R2\\\\\\\\\\\\\\\\\\\\\\\\\\\\\\\\wsmith', 'Account Name: wsmith', 'Account Domain: W8R2', 'Logon ID: 0x475b7', 'Share Information:', 'Object Type: Directory', 'Share Name: \\\\\\\\\\\\\\\\\\\\\\\\\\\\\\\\\\\\\\\\\\\\\\\\\\\\\\\\\\\\\\\\*\\\\\\\\\\\\\\\\\\\\\\\\\\\\\\\\AcmeAccounting', 'Share Path: C:\\\\\\\\\\\\\\\\\\\\\\\\\\\\\\\\AcmeAccounting', 'Old Remark: N/A', 'New Remark: N/A', 'Old MaxUsers: 0xffffffff', 'New Maxusers: 0xffffffff', 'Old ShareFlags: 0x0', 'New ShareFlags: 0x800', 'Old SD: O:S-1-5-21-1850286605-2959700293-454930584-1104G:DUD:(A;OICI;FA;;;BA)(A;OICI;FA;;;WD)', 'New SD: O:S-1-5-21-1850286605-2959700293-454930584-1104G:DUD:(A;OICI;FA;;;BA)(A;OICI;FA;;;WD)']",(?P<Description>.*)\s+Subject:(?:\s+|\S)Security ID:(?:\s+|\S)(?P<SubjectSID>.*)\s+Account Name:(?:\s+|\S)(?P<SubjectAccountName>.*)\s+Account Domain:(?:\s+|\S)(?P<SubjectAccountDomain>.*)\s+Logon ID:(?:\s+|\S)(?P<SubjectLogonID>.*)\s+Share Information:(?:\s+|\S)Object Type:(?:\s+|\S)(?P<ShareInformationObjectType>.*)\s+Share Name:(?:\s+|\S)(?P<ShareInformationShareName>.*)\s+Share Path:(?:\s+|\S)(?P<ShareInformationSharePath>.*)\s+Old Remark:(?:\s+|\S)(?P<ShareInformationOldRemark>.*)\s+New Remark:(?:\s+|\S)(?P<ShareInformationNewRemark>.*)\s+Old MaxUsers:(?:\s+|\S)(?P<ShareInformationOldMaxUsers>.*)\s+New Maxusers:(?:\s+|\S)(?P<ShareInformationNewMaxusers>.*)\s+Old ShareFlags:(?:\s+|\S)(?P<ShareInformationOldShareFlags>.*)\s+New ShareFlags:(?:\s+|\S)(?P<ShareInformationNewShareFlags>.*)\s+Old SD:(?:\s+|\S)(?P<ShareInformationOldSD>.*)\s+New SD:(?:\s+|\S)(?P<ShareInformationNewSD>.*)
"{'Description': 'A network share object was deleted. ', 'SubjectSID': 'W8R2\\wsmith', 'SubjectAccountName': 'wsmith', 'SubjectAccountDomain': 'W8R2', 'SubjectLogonID': '0x475b7', 'SubjectShareInformation': '', 'SubjectShareName': '\\\\*\\AcmeAccounting', 'SubjectSharePath': 'C:\\AcmeAccounting '}",A network share object was deleted.  Subject: Security ID: W8R2\wsmith Account Name: wsmith Account Domain: W8R2 Logon ID: 0x475b7 Share Information:  Share Name: \\*\AcmeAccounting Share Path: C:\AcmeAccounting ,5144,"['A network share object was deleted.', 'Subject:', 'Security ID: W8R2\\\\\\\\\\\\\\\\\\\\\\\\\\\\\\\\wsmith', 'Account Name: wsmith', 'Account Domain: W8R2', 'Logon ID: 0x475b7', 'Share Information: ', 'Share Name: \\\\\\\\\\\\\\\\\\\\\\\\\\\\\\\\\\\\\\\\\\\\\\\\\\\\\\\\\\\\\\\\*\\\\\\\\\\\\\\\\\\\\\\\\\\\\\\\\AcmeAccounting', 'Share Path: C:\\\\\\\\\\\\\\\\\\\\\\\\\\\\\\\\AcmeAccounting']",(?P<Description>.*)\s+Subject:(?:\s+|\S)Security ID:(?:\s+|\S)(?P<SubjectSID>.*)\s+Account Name:(?:\s+|\S)(?P<SubjectAccountName>.*)\s+Account Domain:(?:\s+|\S)(?P<SubjectAccountDomain>.*)\s+Logon ID:(?:\s+|\S)(?P<SubjectLogonID>.*)\s+Share Information:(?:\s+|\S)(?P<SubjectShareInformation>.*)\s+Share Name:(?:\s+|\S)(?P<SubjectShareName>.*)\s+Share Path:(?:\s+|\S)(?P<SubjectSharePath>.*)
