DICT,EX,ID,LIST,REG
"{'Description': 'Example of tree root trust, bidirectional, transitive A new trust was created', 'Description2': 'to', 'Description3': 'a', 'Description4': 'domain.', 'SubjectSID': 'ACME-FR\\administrator', 'SubjectAccountName': 'Administrator', 'SubjectAccountDomain': 'ACME-FR', 'SubjectLogonID': '0x48450', 'TrustedDomainDomainName': 'acme.com', 'TrustedDomainDomainID': 'ACME\\', 'TrustedDomainTrustInformation': '', 'TrustedDomainTrustType': '2', 'TrustedDomainTrustDirection': '3', 'TrustedDomainTrustAttributes': '32', 'TrustedDomainSIDFiltering': 'Disabled'}","Example of tree root trust, bidirectional, transitive A new trust was created to a domain. Subject:  Security ID:  ACME-FR\administrator Account Name:  Administrator Account Domain:  ACME-FR Logon ID:  0x48450 Trusted Domain:  Domain Name:  acme.com Domain ID:  ACME\ Trust Information:   Trust Type:  2 Trust Direction:  3 Trust Attributes:  32 SID Filtering:  Disabled",4706,"['Example of tree root trust', 'bidirectional', 'transitive', 'A new trust was created to a domain.', 'Subject:', ' Security ID:  ACME-FR\\\\\\\\\\\\\\\\\\\\\\\\\\\\\\\\administrator', 'Account Name:  Administrator', 'Account Domain:  ACME-FR', 'Logon ID:  0x48450', 'Trusted Domain:', ' Domain Name:  acme.com', 'Domain ID:  ACME\\\\\\\\\\\\\\\\\\\\\\\\\\\\\\\\', 'Trust Information: ', ' Trust Type:  2', 'Trust Direction:  3', 'Trust Attributes:  32', 'SID Filtering:  Disabled']",(?P<Description>.*)\s+(?P<Description2>.*)\s+(?P<Description3>.*)\s+(?P<Description4>.*)\s+Subject:(?:\s+|\S) Security ID:(?:\s+|\S)(?P<SubjectSID>.*)\s+Account Name:(?:\s+|\S)(?P<SubjectAccountName>.*)\s+Account Domain:(?:\s+|\S)(?P<SubjectAccountDomain>.*)\s+Logon ID:(?:\s+|\S)(?P<SubjectLogonID>.*)\s+Trusted Domain:(?:\s+|\S) Domain Name:(?:\s+|\S)(?P<TrustedDomainDomainName>.*)\s+Domain ID:(?:\s+|\S)(?P<TrustedDomainDomainID>.*)\s+Trust Information:(?:\s+|\S)(?P<TrustedDomainTrustInformation>.*)\s+ Trust Type:(?:\s+|\S)(?P<TrustedDomainTrustType>.*)\s+Trust Direction:(?:\s+|\S)(?P<TrustedDomainTrustDirection>.*)\s+Trust Attributes:(?:\s+|\S)(?P<TrustedDomainTrustAttributes>.*)\s+SID Filtering:(?:\s+|\S)(?P<TrustedDomainSIDFiltering>.*)
"{'Description': 'Example of an external trust being deleted  A trust to a domain was removed. Subject:  Security ID:  ACME-FR\\administrator Account Name:  administrator Account Domain:  ACME-FR Logon ID:  0x20f9d Domain Information:  Domain Name:  MTG Domain ID:  MTG\\ Example of a forest trust being removed A trust to a domain was', 'Description2': 'removed.', 'SubjectSID': 'ACME-FR\\administrator', 'SubjectAccountName': 'administrator', 'SubjectAccountDomain': 'ACME-FR', 'SubjectLogonID': '0x20f9d', 'DomainInformationDomainName': 'MTG', 'DomainInformationDomainID': 'MTG\\ '}",Example of an external trust being deleted  A trust to a domain was removed. Subject:  Security ID:  ACME-FR\administrator Account Name:  administrator Account Domain:  ACME-FR Logon ID:  0x20f9d Domain Information:  Domain Name:  MTG Domain ID:  MTG\ Example of a forest trust being removed A trust to a domain was removed. Subject:  Security ID:  ACME-FR\administrator Account Name:  administrator Account Domain:  ACME-FR Logon ID:  0x20f9d Domain Information:  Domain Name:  MTG Domain ID:  MTG\ ,4707,"['Example of an external trust being deleted ', 'A trust to a domain was removed.', 'Subject:', ' Security ID:  ACME-FR\\\\\\\\\\\\\\\\\\\\\\\\\\\\\\\\administrator', 'Account Name:  administrator', 'Account Domain:  ACME-FR', 'Logon ID:  0x20f9d', 'Domain Information:', ' Domain Name:  MTG', 'Domain ID:  MTG\\\\\\\\\\\\\\\\\\\\\\\\\\\\\\\\']",(?P<Description>.*)\s+(?P<Description2>.*)\s+Subject:(?:\s+|\S) Security ID:(?:\s+|\S)(?P<SubjectSID>.*)\s+Account Name:(?:\s+|\S)(?P<SubjectAccountName>.*)\s+Account Domain:(?:\s+|\S)(?P<SubjectAccountDomain>.*)\s+Logon ID:(?:\s+|\S)(?P<SubjectLogonID>.*)\s+Domain Information:(?:\s+|\S) Domain Name:(?:\s+|\S)(?P<DomainInformationDomainName>.*)\s+Domain ID:(?:\s+|\S)(?P<DomainInformationDomainID>.*)
"{'Description': 'IPsec Services was started.', 'Description2': '%1', 'PolicySource': '%2 %3""', 'Description3': ''}","IPsec Services was started. %1 Policy Source: %2 %3"" ",4709,"['IPsec Services was started.', '%1', 'Policy Source: %2', '%3""']",(?P<Description>.*)\s+(?P<Description2>.*)\s+Policy Source:(?:\s+|\S)(?P<PolicySource>.*)\s+(?P<Description3>.*)
"{'Description': 'IPsec Services was disabled %1', 'Description2': '%2', 'Description3': ''}",IPsec Services was disabled %1 %2 ,4710,"['IPsec Services was disabled', '%1', '%2']",(?P<Description>.*)\s+(?P<Description2>.*)\s+(?P<Description3>.*)
{'Description': '%1 '},Description: %1 ,4711,['Description: %1 '],Description:(?:\s+|\S)(?P<Description>.*)
"{'Description': 'IPsec Services encountered a potentially serious failure. %1', 'Description2': ''}",IPsec Services encountered a potentially serious failure. %1 ,4712,"['IPsec Services encountered a potentially serious failure.', '%1']",(?P<Description>.*)\s+(?P<Description2>.*)
"{'Description': 'Kerberos policy was changed.', 'SubjectSID': 'SYSTEM', 'SubjectAccountName': 'WIN-R9H529RIO4Y$', 'SubjectAccountDomain': 'ACME', 'SubjectLogonID': '0x3e7', 'ChangesMadeKerOpts': '0x80 (none); KerMinT: 0x53d1ac1000 (none); KerMaxT:  0x53d1ac1000 (none); KerMaxR:  0x58028e44000 (none); KerProxy: 0xb2d05e00 (none); KerLogoff: 0x75baf79f00000000 (none); '}",Kerberos policy was changed. Subject:  Security ID:  SYSTEM Account Name:  WIN-R9H529RIO4Y$ Account Domain:  ACME Logon ID:  0x3e7 Changes Made: KerOpts: 0x80 (none); KerMinT: 0x53d1ac1000 (none); KerMaxT:  0x53d1ac1000 (none); KerMaxR:  0x58028e44000 (none); KerProxy: 0xb2d05e00 (none); KerLogoff: 0x75baf79f00000000 (none); ,4713,"['Kerberos policy was changed.', 'Subject:', ' Security ID:  SYSTEM', 'Account Name:  WIN-R9H529RIO4Y$', 'Account Domain:  ACME', 'Logon ID:  0x3e7', 'Changes Made:', 'KerOpts: 0x80 (none);,KerMinT: 0x53d1ac1000 (none);,KerMaxT:  0x53d1ac1000 (none);,KerMaxR:  0x58028e44000 (none);,KerProxy: 0xb2d05e00 (none);,KerLogoff: 0x75baf79f00000000 (none);']",(?P<Description>.*)\s+Subject:(?:\s+|\S) Security ID:(?:\s+|\S)(?P<SubjectSID>.*)\s+Account Name:(?:\s+|\S)(?P<SubjectAccountName>.*)\s+Account Domain:(?:\s+|\S)(?P<SubjectAccountDomain>.*)\s+Logon ID:(?:\s+|\S)(?P<SubjectLogonID>.*)\s+Changes Made:(?:\s+|\S)KerOpts:(?:\s+|\S)(?P<ChangesMadeKerOpts>.*)
"{'Description': 'Encrypted data recovery policy was changed.', 'SubjectSID': 'SYSTEM', 'SubjectAccountName': 'WIN-R9H529RIO4Y$', 'SubjectAccountDomain': 'WORKGROUP', 'SubjectLogonID': '0x3e7', 'SubjectChangesMade': ""('====' means no changes, otherwise each change is shown as: (Parameter Name): (new value) (old value)) PolEfDat: <binary data> (none);  ""}","Encrypted data recovery policy was changed. Subject:  Security ID:  SYSTEM Account Name:  WIN-R9H529RIO4Y$ Account Domain:  WORKGROUP Logon ID:  0x3e7 Changes Made:  ('====' means no changes, otherwise each change is shown as: (Parameter Name): (new value) (old value)) PolEfDat: <binary data> (none);  ",4714,"['Encrypted data recovery policy was changed.', 'Subject:', ' Security ID:  SYSTEM', 'Account Name:  WIN-R9H529RIO4Y$', 'Account Domain:  WORKGROUP', 'Logon ID:  0x3e7', 'Changes Made:,PolEfDat: <binary data> (none); ']",(?P<Description>.*)\s+Subject:(?:\s+|\S) Security ID:(?:\s+|\S)(?P<SubjectSID>.*)\s+Account Name:(?:\s+|\S)(?P<SubjectAccountName>.*)\s+Account Domain:(?:\s+|\S)(?P<SubjectAccountDomain>.*)\s+Logon ID:(?:\s+|\S)(?P<SubjectLogonID>.*)\s+Changes Made:(?:\s+|\S)(?P<SubjectChangesMade>.*)
"{'Description': 'The audit policy (SACL) on an object was changed.', 'SubjectSID': 'ACME\\administrator', 'SubjectAccountName': 'administrator', 'SubjectAccountDomain': 'ACME', 'SubjectLogonID': '0x4bfd71', 'AuditPolicyChangeOriginalSecurityDescriptor': 'D:(A;;DCSWRPDTRC;;;BA)(A;;DCSWRPDTRC;;;SY)', 'AuditPolicyChangeNewSecurityDescriptor': 'D:(A;;DCSWRPDTRC;;;BA(A;;DCSWRPDTRC;;;SY)S:NO_ACCESS_CONTROL '}",The audit policy (SACL) on an object was changed. Subject: Security ID:  ACME\administrator Account Name:  administrator Account Domain:  ACME Logon ID:  0x4bfd71 Audit Policy Change: Original Security Descriptor:  D:(A;;DCSWRPDTRC;;;BA)(A;;DCSWRPDTRC;;;SY) New Security Descriptor:  D:(A;;DCSWRPDTRC;;;BA(A;;DCSWRPDTRC;;;SY)S:NO_ACCESS_CONTROL ,4715,"['The audit policy (SACL) on an object was changed.', 'Subject:', 'Security ID:  ACME\\\\\\\\\\\\\\\\\\\\\\\\\\\\\\\\administrator', 'Account Name:  administrator', 'Account Domain:  ACME', 'Logon ID:  0x4bfd71', 'Audit Policy Change:', 'Original Security Descriptor:  D:(A;;DCSWRPDTRC;;;BA)(A;;DCSWRPDTRC;;;SY)', 'New Security Descriptor:  D:(A;;DCSWRPDTRC;;;BA(A;;DCSWRPDTRC;;;SY)S:NO_ACCESS_CONTROL']",(?P<Description>.*)\s+Subject:(?:\s+|\S)Security ID:(?:\s+|\S)(?P<SubjectSID>.*)\s+Account Name:(?:\s+|\S)(?P<SubjectAccountName>.*)\s+Account Domain:(?:\s+|\S)(?P<SubjectAccountDomain>.*)\s+Logon ID:(?:\s+|\S)(?P<SubjectLogonID>.*)\s+Audit Policy Change:(?:\s+|\S)Original Security Descriptor:(?:\s+|\S)(?P<AuditPolicyChangeOriginalSecurityDescriptor>.*)\s+New Security Descriptor:(?:\s+|\S)(?P<AuditPolicyChangeNewSecurityDescriptor>.*)
"{'Description': 'Trusted domain information was modified.', 'Subject': '', 'SecurityID': 'ACME-FR\\administrator', 'AccountName': 'administrator', 'AccountDomain': 'ACME-FR', 'LogonID': '0x20f9d', 'TrustedDomain': '', 'DomainName': '-', 'DomainID': 'ACME\\', 'NewTrustInformation': '', 'TrustType': '2', 'TrustDirection': '3', 'TrustAttributes': '32', 'SIDFiltering': '- '}",Trusted domain information was modified. Subject:   Security ID:  ACME-FR\administrator Account Name:  administrator Account Domain:  ACME-FR Logon ID:  0x20f9d Trusted Domain:   Domain Name:  - Domain ID:  ACME\ New Trust Information:   Trust Type:  2 Trust Direction:  3 Trust Attributes:  32 SID Filtering:  - ,4716,"['Trusted domain information was modified.', 'Subject: ', ' Security ID:  ACME-FR\\\\\\\\\\\\\\\\\\\\\\\\\\\\\\\\administrator', 'Account Name:  administrator', 'Account Domain:  ACME-FR', 'Logon ID:  0x20f9d', 'Trusted Domain: ', ' Domain Name:  -', 'Domain ID:  ACME\\\\\\\\\\\\\\\\\\\\\\\\\\\\\\\\', 'New Trust Information: ', ' Trust Type:  2', 'Trust Direction:  3', 'Trust Attributes:  32', 'SID Filtering:  -']",(?P<Description>.*)\s+Subject:(?:\s+|\S)(?P<Subject>.*)\s+ Security ID:(?:\s+|\S)(?P<SecurityID>.*)\s+Account Name:(?:\s+|\S)(?P<AccountName>.*)\s+Account Domain:(?:\s+|\S)(?P<AccountDomain>.*)\s+Logon ID:(?:\s+|\S)(?P<LogonID>.*)\s+Trusted Domain:(?:\s+|\S)(?P<TrustedDomain>.*)\s+ Domain Name:(?:\s+|\S)(?P<DomainName>.*)\s+Domain ID:(?:\s+|\S)(?P<DomainID>.*)\s+New Trust Information:(?:\s+|\S)(?P<NewTrustInformation>.*)\s+ Trust Type:(?:\s+|\S)(?P<TrustType>.*)\s+Trust Direction:(?:\s+|\S)(?P<TrustDirection>.*)\s+Trust Attributes:(?:\s+|\S)(?P<TrustAttributes>.*)\s+SID Filtering:(?:\s+|\S)(?P<SIDFiltering>.*)
"{'Description': 'System security access was granted to an account.', 'SubjectSID': 'SYSTEM', 'SubjectAccountName': 'WIN-R9H529RIO4Y$', 'SubjectAccountDomain': 'WORKGROUP', 'SubjectLogonID': '0x3e7', 'AccountModifiedAccountName': 'BUILTIN\\Users', 'AccessGrantedAccessRight': 'SeNetworkLogonRight '}",System security access was granted to an account. Subject:  Security ID:  SYSTEM Account Name:  WIN-R9H529RIO4Y$ Account Domain:  WORKGROUP Logon ID:  0x3e7 Account Modified:  Account Name:  BUILTIN\Users Access Granted:  Access Right:  SeNetworkLogonRight ,4717,"['System security access was granted to an account.', 'Subject:', ' Security ID:  SYSTEM', 'Account Name:  WIN-R9H529RIO4Y$', 'Account Domain:  WORKGROUP', 'Logon ID:  0x3e7', 'Account Modified:', ' Account Name:  BUILTIN\\\\\\\\\\\\\\\\\\\\\\\\\\\\\\\\Users', 'Access Granted:', ' Access Right:  SeNetworkLogonRight']",(?P<Description>.*)\s+Subject:(?:\s+|\S) Security ID:(?:\s+|\S)(?P<SubjectSID>.*)\s+Account Name:(?:\s+|\S)(?P<SubjectAccountName>.*)\s+Account Domain:(?:\s+|\S)(?P<SubjectAccountDomain>.*)\s+Logon ID:(?:\s+|\S)(?P<SubjectLogonID>.*)\s+Account Modified:(?:\s+|\S) Account Name:(?:\s+|\S)(?P<AccountModifiedAccountName>.*)\s+Access Granted:(?:\s+|\S) Access Right:(?:\s+|\S)(?P<AccessGrantedAccessRight>.*)
"{'Description': 'System security access was removed from an account.', 'SubjectSID': 'SYSTEM', 'SubjectAccountName': 'WIN-R9H529RIO4Y$', 'SubjectAccountDomain': 'WORKGROUP', 'SubjectLogonID': '0x3e7', 'AccountModifiedAccountName': 'BUILTIN\\Users', 'AccessRemovedAccessRight': 'SeNetworkLogonRight '}",System security access was removed from an account. Subject:  Security ID:  SYSTEM Account Name:  WIN-R9H529RIO4Y$ Account Domain:  WORKGROUP Logon ID:  0x3e7 Account Modified:  Account Name:  BUILTIN\Users Access Removed:  Access Right:  SeNetworkLogonRight ,4718,"['System security access was removed from an account.', 'Subject:', ' Security ID:  SYSTEM', 'Account Name:  WIN-R9H529RIO4Y$', 'Account Domain:  WORKGROUP', 'Logon ID:  0x3e7', 'Account Modified:', ' Account Name:  BUILTIN\\\\\\\\\\\\\\\\\\\\\\\\\\\\\\\\Users', 'Access Removed:', ' Access Right:  SeNetworkLogonRight']",(?P<Description>.*)\s+Subject:(?:\s+|\S) Security ID:(?:\s+|\S)(?P<SubjectSID>.*)\s+Account Name:(?:\s+|\S)(?P<SubjectAccountName>.*)\s+Account Domain:(?:\s+|\S)(?P<SubjectAccountDomain>.*)\s+Logon ID:(?:\s+|\S)(?P<SubjectLogonID>.*)\s+Account Modified:(?:\s+|\S) Account Name:(?:\s+|\S)(?P<AccountModifiedAccountName>.*)\s+Access Removed:(?:\s+|\S) Access Right:(?:\s+|\S)(?P<AccessRemovedAccessRight>.*)
"{'Description': 'System audit policy was changed.', 'SubjectSID': 'S-1-5-21-3108364787-189202583-342365621-500', 'SubjectAccountName': 'Administrator', 'SubjectAccountDomain': 'WIN-R9H529RIO4Y', 'SubjectLogonID': '0x169e9', 'AuditPolicyChangeCategory': 'Logon/Logoff', 'AuditPolicyChangeSubcategory': 'Special Logon', 'AuditPolicyChangeSubcategoryGUID': '{0CCE921B-69AE-11D9-BED3-505054503030}', 'AuditPolicyChangeChanges': 'Failure added  '}",System audit policy was changed. Subject:  Security ID:  S-1-5-21-3108364787-189202583-342365621-500 Account Name:  Administrator Account Domain:  WIN-R9H529RIO4Y Logon ID:  0x169e9 Audit Policy Change:  Category:  Logon/Logoff Subcategory:  Special Logon Subcategory GUID: {0CCE921B-69AE-11D9-BED3-505054503030} Changes:  Failure added  ,4719,"['System audit policy was changed.', 'Subject:', ' Security ID:  S-1-5-21-3108364787-189202583-342365621-500', 'Account Name:  Administrator', 'Account Domain:  WIN-R9H529RIO4Y', 'Logon ID:  0x169e9', 'Audit Policy Change:', ' Category:  Logon/Logoff', 'Subcategory:  Special Logon', 'Subcategory GUID: {0CCE921B-69AE-11D9-BED3-505054503030}', 'Changes:  Failure added']",(?P<Description>.*)\s+Subject:(?:\s+|\S) Security ID:(?:\s+|\S)(?P<SubjectSID>.*)\s+Account Name:(?:\s+|\S)(?P<SubjectAccountName>.*)\s+Account Domain:(?:\s+|\S)(?P<SubjectAccountDomain>.*)\s+Logon ID:(?:\s+|\S)(?P<SubjectLogonID>.*)\s+Audit Policy Change:(?:\s+|\S) Category:(?:\s+|\S)(?P<AuditPolicyChangeCategory>.*)\s+Subcategory:(?:\s+|\S)(?P<AuditPolicyChangeSubcategory>.*)\s+Subcategory GUID:(?:\s+|\S)(?P<AuditPolicyChangeSubcategoryGUID>.*)\s+Changes:(?:\s+|\S)(?P<AuditPolicyChangeChanges>.*)
"{'Description': 'A user account was created.', 'SubjectSID': 'ACME-FR\\administrator', 'SubjectAccountName': 'administrator', 'SubjectAccountDomain': 'ACME-FR', 'SubjectLogonID': '0x20f9d', 'NewAccountSecurityID': 'ACME-FR\\John.Locke', 'NewAccountAccountName': 'John.Locke', 'NewAccountAccountDomain': 'ACME-FR', 'AttributesSAMAccountName': 'John.Locke', 'AttributesDisplayName': 'John Locke', 'AttributesUserPrincipalName': 'John.Locke@acme-fr.local', 'AttributesHomeDirectory': '-', 'AttributesHomeDrive': '-', 'AttributesScriptPath': '-', 'AttributesProfilePath': '-', 'AttributesUserWorkstations': '-', 'AttributesPasswordLastSet': '<never>', 'AttributesAccountExpires': '<never>', 'AttributesPrimaryGroupID': '513', 'AttributesAllowedToDelegateTo': '-', 'AttributesOldUACValue': '0x0', 'AttributesNewUACValue': '0x15', 'AttributesUserAccountControl': ""Account Disabled 'Password Not Required' - Enabled 'Normal"", 'Description2': ""Account'"", 'Description3': '-', 'Description4': 'Enabled', 'AttributesUserParameters': '-', 'AttributesSIDHistory': '-', 'AttributesLogonHours': '<value not set>', 'Description5': 'Privileges -  '}",A user account was created. Subject:  Security ID:  ACME-FR\administrator Account Name:  administrator Account Domain:  ACME-FR Logon ID:  0x20f9d New Account:  Security ID:  ACME-FR\John.Locke Account Name:  John.Locke Account Domain:  ACME-FR Attributes:  SAM Account Name: John.Locke Display Name:  John Locke User Principal Name: John.Locke@acme-fr.local Home Directory:  - Home Drive:  - Script Path:  - Profile Path:  - User Workstations: - Password Last Set: <never> Account Expires:  <never> Primary Group ID: 513 Allowed To Delegate To: - Old UAC Value:  0x0 New UAC Value:  0x15 User Account Control:  Account Disabled 'Password Not Required' - Enabled 'Normal Account' - Enabled User Parameters: - SID History:  - Logon Hours:  <value not set> Additional Information:  Privileges -  ,4720,"['A user account was created.', 'Subject:', ' Security ID:  ACME-FR\\\\\\\\\\\\\\\\\\\\\\\\\\\\\\\\administrator', 'Account Name:  administrator', 'Account Domain:  ACME-FR', 'Logon ID:  0x20f9d', 'New Account:', ' Security ID:  ACME-FR\\\\\\\\\\\\\\\\\\\\\\\\\\\\\\\\John.Locke', 'Account Name:  John.Locke', 'Account Domain:  ACME-FR', 'Attributes:', ' SAM Account Name: John.Locke', 'Display Name:  John Locke', 'User Principal Name: John.Locke@acme-fr.local', 'Home Directory:  -', 'Home Drive:  -', 'Script Path:  -', 'Profile Path:  -', 'User Workstations: -', 'Password Last Set: <never>', 'Account Expires:  <never>', 'Primary Group ID: 513', 'Allowed To Delegate To: -', 'Old UAC Value:  0x0', 'New UAC Value:  0x15', 'User Account Control: ', 'Account Disabled', '""Password Not Required - Enabled""', '""Normal Account - Enabled""', 'User Parameters: -', 'SID History:  -', 'Logon Hours:  <value not set>', 'Additional Information:', ' Privileges -']",(?P<Description>.*)\s+Subject:(?:\s+|\S) Security ID:(?:\s+|\S)(?P<SubjectSID>.*)\s+Account Name:(?:\s+|\S)(?P<SubjectAccountName>.*)\s+Account Domain:(?:\s+|\S)(?P<SubjectAccountDomain>.*)\s+Logon ID:(?:\s+|\S)(?P<SubjectLogonID>.*)\s+New Account:(?:\s+|\S) Security ID:(?:\s+|\S)(?P<NewAccountSecurityID>.*)\s+Account Name:(?:\s+|\S)(?P<NewAccountAccountName>.*)\s+Account Domain:(?:\s+|\S)(?P<NewAccountAccountDomain>.*)\s+Attributes:(?:\s+|\S) SAM Account Name:(?:\s+|\S)(?P<AttributesSAMAccountName>.*)\s+Display Name:(?:\s+|\S)(?P<AttributesDisplayName>.*)\s+User Principal Name:(?:\s+|\S)(?P<AttributesUserPrincipalName>.*)\s+Home Directory:(?:\s+|\S)(?P<AttributesHomeDirectory>.*)\s+Home Drive:(?:\s+|\S)(?P<AttributesHomeDrive>.*)\s+Script Path:(?:\s+|\S)(?P<AttributesScriptPath>.*)\s+Profile Path:(?:\s+|\S)(?P<AttributesProfilePath>.*)\s+User Workstations:(?:\s+|\S)(?P<AttributesUserWorkstations>.*)\s+Password Last Set:(?:\s+|\S)(?P<AttributesPasswordLastSet>.*)\s+Account Expires:(?:\s+|\S)(?P<AttributesAccountExpires>.*)\s+Primary Group ID:(?:\s+|\S)(?P<AttributesPrimaryGroupID>.*)\s+Allowed To Delegate To:(?:\s+|\S)(?P<AttributesAllowedToDelegateTo>.*)\s+Old UAC Value:(?:\s+|\S)(?P<AttributesOldUACValue>.*)\s+New UAC Value:(?:\s+|\S)(?P<AttributesNewUACValue>.*)\s+User Account Control:(?:\s+|\S)(?P<AttributesUserAccountControl>.*)\s+(?P<Description2>.*)\s+(?P<Description3>.*)\s+(?P<Description4>.*)\s+User Parameters:(?:\s+|\S)(?P<AttributesUserParameters>.*)\s+SID History:(?:\s+|\S)(?P<AttributesSIDHistory>.*)\s+Logon Hours:(?:\s+|\S)(?P<AttributesLogonHours>.*)\s+Additional Information:(?:\s+|\S)(?P<Description5>.*)
"{'Description': 'A user account was enabled.', 'SubjectSID': 'ACME-FR\\administrator', 'SubjectAccountName': 'administrator', 'SubjectAccountDomain': 'ACME-FR', 'SubjectLogonID': '0x20f9d', 'TargetAccountSecurityID': 'ACME-FR\\John.Locke', 'TargetAccountAccountName': 'John.Locke', 'TargetAccountAccountDomain': 'ACME-FR  '}",A user account was enabled. Subject:  Security ID:  ACME-FR\administrator Account Name:  administrator Account Domain:  ACME-FR Logon ID:  0x20f9d Target Account:  Security ID:  ACME-FR\John.Locke Account Name:  John.Locke Account Domain:  ACME-FR  ,4722,"['A user account was enabled.', 'Subject:', ' Security ID:  ACME-FR\\\\\\\\\\\\\\\\\\\\\\\\\\\\\\\\administrator', 'Account Name:  administrator', 'Account Domain:  ACME-FR', 'Logon ID:  0x20f9d', 'Target Account:', 'Security ID:  ACME-FR\\\\\\\\\\\\\\\\\\\\\\\\\\\\\\\\John.Locke', 'Account Name:  John.Locke', 'Account Domain:  ACME-FR']",(?P<Description>.*)\s+Subject:(?:\s+|\S) Security ID:(?:\s+|\S)(?P<SubjectSID>.*)\s+Account Name:(?:\s+|\S)(?P<SubjectAccountName>.*)\s+Account Domain:(?:\s+|\S)(?P<SubjectAccountDomain>.*)\s+Logon ID:(?:\s+|\S)(?P<SubjectLogonID>.*)\s+Target Account:(?:\s+|\S)Security ID:(?:\s+|\S)(?P<TargetAccountSecurityID>.*)\s+Account Name:(?:\s+|\S)(?P<TargetAccountAccountName>.*)\s+Account Domain:(?:\s+|\S)(?P<TargetAccountAccountDomain>.*)
"{'Description': ""An attempt was made to change an account's password."", 'SubjectSID': 'WIN-R9H529RIO4Y\\Administrator', 'SubjectAccountName': 'Administrator', 'SubjectAccountDomain': 'WIN-R9H529RIO4Y', 'SubjectLogonID': '0x1fd23 ', 'TargetAccountSecurityID': 'WIN-R9H529RIO4Y\\Administrator', 'TargetAccountAccountName': 'Administrator', 'TargetAccountAccountDomain': 'WIN-R9H529RIO4Y ', 'Description2': 'Privileges - '}",An attempt was made to change an account's password. Subject:   Security ID:  WIN-R9H529RIO4Y\Administrator Account Name:  Administrator Account Domain:  WIN-R9H529RIO4Y Logon ID:  0x1fd23  Target Account:   Security ID:  WIN-R9H529RIO4Y\Administrator Account Name:  Administrator Account Domain:  WIN-R9H529RIO4Y  Additional Information:   Privileges - ,4723,"['""An attempt was made to change an accounts password.""', 'Subject:', '  Security ID:  WIN-R9H529RIO4Y\\\\\\\\\\\\\\\\\\\\\\\\\\\\\\\\Administrator', 'Account Name:  Administrator', 'Account Domain:  WIN-R9H529RIO4Y', 'Logon ID:  0x1fd23 ', 'Target Account:', '  Security ID:  WIN-R9H529RIO4Y\\\\\\\\\\\\\\\\\\\\\\\\\\\\\\\\Administrator', 'Account Name:  Administrator', 'Account Domain:  WIN-R9H529RIO4Y ', 'Additional Information:', '  Privileges -']",(?P<Description>.*)\s+Subject:(?:\s+|\S)  Security ID:(?:\s+|\S)(?P<SubjectSID>.*)\s+Account Name:(?:\s+|\S)(?P<SubjectAccountName>.*)\s+Account Domain:(?:\s+|\S)(?P<SubjectAccountDomain>.*)\s+Logon ID:(?:\s+|\S)(?P<SubjectLogonID>.*)\s+Target Account:(?:\s+|\S)  Security ID:(?:\s+|\S)(?P<TargetAccountSecurityID>.*)\s+Account Name:(?:\s+|\S)(?P<TargetAccountAccountName>.*)\s+Account Domain:(?:\s+|\S)(?P<TargetAccountAccountDomain>.*)\s+Additional Information:(?:\s+|\S)(?P<Description2>.*)
"{'Description': ""An attempt was made to reset an account's password."", 'SubjectSID': 'WIN-R9H529RIO4Y\\Administrator', 'SubjectAccountName': 'Administrator', 'SubjectAccountDomain': 'WIN-R9H529RIO4Y', 'SubjectLogonID': '0x1fd23', 'TargetAccountSecurityID': 'WIN-R9H529RIO4Y\\bob', 'TargetAccountAccountName': 'bob', 'TargetAccountAccountDomain': 'WIN-R9H529RIO4Y '}",An attempt was made to reset an account's password. Subject:  Security ID:  WIN-R9H529RIO4Y\Administrator Account Name:  Administrator Account Domain:  WIN-R9H529RIO4Y Logon ID:  0x1fd23 Target Account:  Security ID:  WIN-R9H529RIO4Y\bob Account Name:  bob Account Domain:  WIN-R9H529RIO4Y ,4724,"['""An attempt was made to reset an accounts password.""', 'Subject:', ' Security ID:  WIN-R9H529RIO4Y\\\\\\\\\\\\\\\\\\\\\\\\\\\\\\\\Administrator', 'Account Name:  Administrator', 'Account Domain:  WIN-R9H529RIO4Y', 'Logon ID:  0x1fd23', 'Target Account:', ' Security ID:  WIN-R9H529RIO4Y\\\\\\\\\\\\\\\\\\\\\\\\\\\\\\\\bob', 'Account Name:  bob', 'Account Domain:  WIN-R9H529RIO4Y']",(?P<Description>.*)\s+Subject:(?:\s+|\S) Security ID:(?:\s+|\S)(?P<SubjectSID>.*)\s+Account Name:(?:\s+|\S)(?P<SubjectAccountName>.*)\s+Account Domain:(?:\s+|\S)(?P<SubjectAccountDomain>.*)\s+Logon ID:(?:\s+|\S)(?P<SubjectLogonID>.*)\s+Target Account:(?:\s+|\S) Security ID:(?:\s+|\S)(?P<TargetAccountSecurityID>.*)\s+Account Name:(?:\s+|\S)(?P<TargetAccountAccountName>.*)\s+Account Domain:(?:\s+|\S)(?P<TargetAccountAccountDomain>.*)
"{'Description': 'A user account was disabled.', 'SubjectSID': 'WIN-R9H529RIO4Y\\Administrator', 'SubjectAccountName': 'Administrator', 'SubjectAccountDomain': 'WIN-R9H529RIO4Y', 'SubjectLogonID': '0x1fd23', 'TargetAccountSecurityID': 'WIN-R9H529RIO4Y\\bob', 'TargetAccountAccountName': 'bob', 'TargetAccountAccountDomain': 'WIN-R9H529RIO4Y '}",A user account was disabled. Subject:  Security ID:  WIN-R9H529RIO4Y\Administrator Account Name:  Administrator Account Domain:  WIN-R9H529RIO4Y Logon ID:  0x1fd23 Target Account:  Security ID:  WIN-R9H529RIO4Y\bob Account Name:  bob Account Domain:  WIN-R9H529RIO4Y ,4725,"['A user account was disabled.', 'Subject:', ' Security ID:  WIN-R9H529RIO4Y\\\\\\\\\\\\\\\\\\\\\\\\\\\\\\\\Administrator', 'Account Name:  Administrator', 'Account Domain:  WIN-R9H529RIO4Y', 'Logon ID:  0x1fd23', 'Target Account:', ' Security ID:  WIN-R9H529RIO4Y\\\\\\\\\\\\\\\\\\\\\\\\\\\\\\\\bob', 'Account Name:  bob', 'Account Domain:  WIN-R9H529RIO4Y']",(?P<Description>.*)\s+Subject:(?:\s+|\S) Security ID:(?:\s+|\S)(?P<SubjectSID>.*)\s+Account Name:(?:\s+|\S)(?P<SubjectAccountName>.*)\s+Account Domain:(?:\s+|\S)(?P<SubjectAccountDomain>.*)\s+Logon ID:(?:\s+|\S)(?P<SubjectLogonID>.*)\s+Target Account:(?:\s+|\S) Security ID:(?:\s+|\S)(?P<TargetAccountSecurityID>.*)\s+Account Name:(?:\s+|\S)(?P<TargetAccountAccountName>.*)\s+Account Domain:(?:\s+|\S)(?P<TargetAccountAccountDomain>.*)
