DICT,EX,ID,LIST,REG
"{'Description': 'Central Access Policies on the machine have been changed.', 'SubjectSID': '%1', 'SubjectAccountName': '%2', 'SubjectAccountDomain': '%3', 'SubjectLogonID': '%4', 'ObjectObjectServer': '%5', 'ObjectObjectType': '%6', 'ObjectCAPsAdded': '%7', 'ObjectCAPsDeleted': '%8', 'ObjectCAPsModified': '%9', 'ObjectCAPsAsIs': '%10 '}",Central Access Policies on the machine have been changed. Subject: Security ID:  %1 Account Name:  %2 Account Domain:  %3 Logon ID:   %4 Object: Object Server:  %5 Object Type:  %6 CAPs Added:  %7 CAPs Deleted:   %8 CAPs Modified:  %9 CAPs As-Is:  %10 ,4819,"['Central Access Policies on the machine have been changed.', 'Subject:', 'Security ID:  %1', 'Account Name:  %2', 'Account Domain:  %3', 'Logon ID:   %4', 'Object:', 'Object Server:  %5', 'Object Type:  %6', 'CAPs Added:  %7', 'CAPs Deleted:   %8', 'CAPs Modified:  %9', 'CAPs As-Is:  %10']",(?P<Description>.*)\s+Subject:(?:\s+|\S)Security ID:(?:\s+|\S)(?P<SubjectSID>.*)\s+Account Name:(?:\s+|\S)(?P<SubjectAccountName>.*)\s+Account Domain:(?:\s+|\S)(?P<SubjectAccountDomain>.*)\s+Logon ID:(?:\s+|\S)(?P<SubjectLogonID>.*)\s+Object:(?:\s+|\S)Object Server:(?:\s+|\S)(?P<ObjectObjectServer>.*)\s+Object Type:(?:\s+|\S)(?P<ObjectObjectType>.*)\s+CAPs Added:(?:\s+|\S)(?P<ObjectCAPsAdded>.*)\s+CAPs Deleted:(?:\s+|\S)(?P<ObjectCAPsDeleted>.*)\s+CAPs Modified:(?:\s+|\S)(?P<ObjectCAPsModified>.*)\s+CAPs As-Is:(?:\s+|\S)(?P<ObjectCAPsAsIs>.*)
"{'Description': 'A Kerberos Ticket-granting-ticket (TGT) was denied because the device does not meet the access control restrictions.', 'AccountInformationAccountName': 'bofh ', 'SuppliedRealmNameUserID': 'SANDBOX\\bofh', 'AuthenticationPolicyInformationSiloName': 'ADAdminSilo ', 'AuthenticationPolicyInformationPolicyName': 'ADAdminPolicy ', 'AuthenticationPolicyInformationTGTLifetime': '45', 'DeviceInformationDeviceName': 'MS$', 'ServiceInformationServiceName': 'krbtgt/SANDBOX ', 'ServiceInformationServiceID': 'S-1-5-21-1845158320-1047333904-1474639767-0', 'NetworkInformationClientAddress': '::ffff:192.168.1.213 ', 'NetworkInformationClientPort': '49222', 'AdditionalInformationTicketOptions': '0x78 ', 'AdditionalInformationResultCode': '0xC ', 'AdditionalInformationTicketEncryptionType': '0x7 ', 'AdditionalInformationPreAuthenticationType': '0', 'Description2': 'Certificate information is only provided if a certificate was used for pre-authentication. Pre-authentication types, ticket options, encryption types and result codes are defined in', 'Description3': 'RFC', 'Description4': '4120.', 'Description5': ''}","A Kerberos Ticket-granting-ticket (TGT) was denied because the device does not meet the access control restrictions. Account Information:  Account Name: bofh  Supplied Realm Name:   User ID:  SANDBOX\bofh Authentication Policy Information:  Silo Name: ADAdminSilo  Policy Name: ADAdminPolicy  TGT Lifetime: 45 Device Information: Device Name: MS$ Service Information:  Service Name: krbtgt/SANDBOX  Service ID: S-1-5-21-1845158320-1047333904-1474639767-0 Network Information:  Client Address: ::ffff:192.168.1.213  Client Port: 49222 Additional Information:  Ticket Options: 0x78  Result Code: 0xC  Ticket Encryption Type: 0x7  Pre-Authentication Type: 0 Certificate Information:  Certificate Issuer Name:   Certificate Serial Number:   Certificate Thumbprint:  Certificate information is only provided if a certificate was used for pre-authentication. Pre-authentication types, ticket options, encryption types and result codes are defined in RFC 4120. ",4820,"['A Kerberos Ticket-granting-ticket (TGT) was denied because the device does not meet the access control restrictions.', 'Account Information:', 'Account Name:bofh', 'Supplied Realm Name:', 'User ID:SANDBOX\\\\\\\\\\\\\\\\\\\\\\\\\\\\\\\\bofh', 'Authentication Policy Information:', 'Silo Name:ADAdminSilo', 'Policy Name:ADAdminPolicy', 'TGT Lifetime:45', 'Device Information:', 'Device Name:MS$', 'Service Information:', 'Service Name:krbtgt/SANDBOX', 'Service ID:S-1-5-21-1845158320-1047333904-1474639767-0', 'Network Information:', 'Client Address:::ffff:192.168.1.213', 'Client Port:49222', 'Additional Information:', 'Ticket Options:0x78', 'Result Code:0xC', 'Ticket Encryption Type:0x7', 'Pre-Authentication Type:0', 'Certificate Information:', 'Certificate Issuer Name:', 'Certificate Serial Number:', 'Certificate Thumbprint:', 'Certificate information is only provided if a certificate was used for pre-authentication.', 'Pre-authentication types', 'ticket options', 'encryption types and result codes are defined in RFC 4120.']",(?P<Description>.*)\s+Account Information:(?:\s+|\S)Account Name:(?:\s+|\S)(?P<AccountInformationAccountName>.*)\s+Supplied Realm Name:(?:\s+|\S)User ID:(?:\s+|\S)(?P<SuppliedRealmNameUserID>.*)\s+Authentication Policy Information:(?:\s+|\S)Silo Name:(?:\s+|\S)(?P<AuthenticationPolicyInformationSiloName>.*)\s+Policy Name:(?:\s+|\S)(?P<AuthenticationPolicyInformationPolicyName>.*)\s+TGT Lifetime:(?:\s+|\S)(?P<AuthenticationPolicyInformationTGTLifetime>.*)\s+Device Information:(?:\s+|\S)Device Name:(?:\s+|\S)(?P<DeviceInformationDeviceName>.*)\s+Service Information:(?:\s+|\S)Service Name:(?:\s+|\S)(?P<ServiceInformationServiceName>.*)\s+Service ID:(?:\s+|\S)(?P<ServiceInformationServiceID>.*)\s+Network Information:(?:\s+|\S)Client Address:(?:\s+|\S)(?P<NetworkInformationClientAddress>.*)\s+Client Port:(?:\s+|\S)(?P<NetworkInformationClientPort>.*)\s+Additional Information:(?:\s+|\S)Ticket Options:(?:\s+|\S)(?P<AdditionalInformationTicketOptions>.*)\s+Result Code:(?:\s+|\S)(?P<AdditionalInformationResultCode>.*)\s+Ticket Encryption Type:(?:\s+|\S)(?P<AdditionalInformationTicketEncryptionType>.*)\s+Pre-Authentication Type:(?:\s+|\S)(?P<AdditionalInformationPreAuthenticationType>.*)\s+Certificate Information:(?:\s+|\S)Certificate Issuer Name:(?:\s+|\S)Certificate Serial Number:(?:\s+|\S)Certificate Thumbprint:(?:\s+|\S)(?P<Description2>.*)\s+(?P<Description3>.*)\s+(?P<Description4>.*)\s+(?P<Description5>.*)
"{'Description': 'A Kerberos service ticket was denied because the user, device, or both does not meet the access', 'Description2': 'control', 'Description3': 'restrictions.', 'AccountInformationAccountName': '%1', 'AccountInformationAccountDomain': '%2', 'AccountInformationLogonGUID': '%11', 'AuthenticationPolicyInformationSiloName': '%13', 'AuthenticationPolicyInformationPolicyName': '%14', 'DeviceInformationDeviceName': '%3', 'ServiceInformationServiceName': '%4', 'ServiceInformationServiceID': '%5', 'NetworkInformationClientAddress': '%8', 'NetworkInformationClientPort': '%9', 'AdditionalInformationTicketOptions': '%6', 'AdditionalInformationTicketEncryptionType': '%7', 'AdditionalInformationFailureCode': '%10', 'AdditionalInformationTransitedServices': '%12 '}","A Kerberos service ticket was denied because the user, device, or both does not meet the access control restrictions. Account Information: Account Name:   %1 Account Domain:   %2 Logon GUID:   %11 Authentication Policy Information: Silo Name:   %13 Policy Name:     %14 Device Information: Device Name:     %3 Service Information: Service Name:     %4 Service ID:      %5 Network Information: Client Address:   %8 Client Port:   %9 Additional Information: Ticket Options:   %6 Ticket Encryption Type: %7 Failure Code:   %10 Transited Services:  %12 ",4821,"['A Kerberos service ticket was denied because the user', 'device', 'or both does not meet the access control restrictions.', 'Account Information:', 'Account Name:   %1', 'Account Domain:   %2', 'Logon GUID:   %11', 'Authentication Policy Information:', 'Silo Name:   %13', 'Policy Name:     %14', 'Device Information:', 'Device Name:     %3', 'Service Information:', 'Service Name:     %4', 'Service ID:      %5', 'Network Information:', 'Client Address:   %8', 'Client Port:   %9', 'Additional Information:', 'Ticket Options:   %6', 'Ticket Encryption Type: %7', 'Failure Code:   %10', 'Transited Services:  %12']",(?P<Description>.*)\s+(?P<Description2>.*)\s+(?P<Description3>.*)\s+Account Information:(?:\s+|\S)Account Name:(?:\s+|\S)(?P<AccountInformationAccountName>.*)\s+Account Domain:(?:\s+|\S)(?P<AccountInformationAccountDomain>.*)\s+Logon GUID:(?:\s+|\S)(?P<AccountInformationLogonGUID>.*)\s+Authentication Policy Information:(?:\s+|\S)Silo Name:(?:\s+|\S)(?P<AuthenticationPolicyInformationSiloName>.*)\s+Policy Name:(?:\s+|\S)(?P<AuthenticationPolicyInformationPolicyName>.*)\s+Device Information:(?:\s+|\S)Device Name:(?:\s+|\S)(?P<DeviceInformationDeviceName>.*)\s+Service Information:(?:\s+|\S)Service Name:(?:\s+|\S)(?P<ServiceInformationServiceName>.*)\s+Service ID:(?:\s+|\S)(?P<ServiceInformationServiceID>.*)\s+Network Information:(?:\s+|\S)Client Address:(?:\s+|\S)(?P<NetworkInformationClientAddress>.*)\s+Client Port:(?:\s+|\S)(?P<NetworkInformationClientPort>.*)\s+Additional Information:(?:\s+|\S)Ticket Options:(?:\s+|\S)(?P<AdditionalInformationTicketOptions>.*)\s+Ticket Encryption Type:(?:\s+|\S)(?P<AdditionalInformationTicketEncryptionType>.*)\s+Failure Code:(?:\s+|\S)(?P<AdditionalInformationFailureCode>.*)\s+Transited Services:(?:\s+|\S)(?P<AdditionalInformationTransitedServices>.*)
"{'Description': 'NTLM authentication failed because the account was a member of the Protected User group.', 'AccountName': '%1', 'DeviceName': '%2', 'ErrorCode': '%3 '}",NTLM authentication failed because the account was a member of the Protected User group. Account Name:  %1 Device Name:  %2 Error Code:  %3 ,4822,"['NTLM authentication failed because the account was a member of the Protected User group.', 'Account Name:  %1', 'Device Name:  %2', 'Error Code:  %3']",(?P<Description>.*)\s+Account Name:(?:\s+|\S)(?P<AccountName>.*)\s+Device Name:(?:\s+|\S)(?P<DeviceName>.*)\s+Error Code:(?:\s+|\S)(?P<ErrorCode>.*)
"{'Description': 'NTLM authentication failed because access control restrictions are required.', 'AccountName': '%1', 'DeviceName': '%2', 'ErrorCode': '%3', 'AuthenticationPolicyInformationSiloName': '%4', 'AuthenticationPolicyInformationPolicyName': '%5 '}",NTLM authentication failed because access control restrictions are required. Account Name:  %1 Device Name:  %2 Error Code:  %3 Authentication Policy Information: Silo Name:  %4 PolicyName: %5 ,4823,"['NTLM authentication failed because access control restrictions are required.', 'Account Name:  %1', 'Device Name:  %2', 'Error Code:  %3', 'Authentication Policy Information:', 'Silo Name:  %4', 'PolicyName: %5']",(?P<Description>.*)\s+Account Name:(?:\s+|\S)(?P<AccountName>.*)\s+Device Name:(?:\s+|\S)(?P<DeviceName>.*)\s+Error Code:(?:\s+|\S)(?P<ErrorCode>.*)\s+Authentication Policy Information:(?:\s+|\S)Silo Name:(?:\s+|\S)(?P<AuthenticationPolicyInformationSiloName>.*)\s+PolicyName:(?:\s+|\S)(?P<AuthenticationPolicyInformationPolicyName>.*)
"{'Description': 'Kerberos preauthentication by using DES or RC4 failed because the account was a member of the Protected User group.', 'AccountInformationSecurityID': '%2', 'AccountInformationAccountName': '%1', 'ServiceInformationServiceName': '%3', 'NetworkInformationClientAddress': '%7', 'NetworkInformationClientPort': '%8', 'AdditionalInformationTicketOptions': '%4', 'AdditionalInformationFailureCode': '%5', 'AdditionalInformationPreAuthenticationType': '%6', 'CertificateInformationCertificateIssuerName': '%9', 'CertificateInformationCertificateSerialNumber': '%10', 'CertificateInformationCertificateThumbprint': '%11 Certificate information is only provided if a certificate was used for pre-authentication. Pre-authentication types, ticket options and failure codes are defined in RFC 4120. If the ticket was malformed or damaged during transit and could not be decrypted, then many fields in this event might not be present. '}","Kerberos preauthentication by using DES or RC4 failed because the account was a member of the Protected User group. Account Information: Security ID:      %2 Account Name:     %1 Service Information: Service Name:     %3 Network Information: Client Address:     %7 Client Port:      %8 Additional Information: Ticket Options:   %4 Failure Code:     %5 Pre-Authentication Type: %6 Certificate Information: Certificate Issuer Name:   %9 Certificate Serial Number:  %10 Certificate Thumbprint:   %11 Certificate information is only provided if a certificate was used for pre-authentication. Pre-authentication types, ticket options and failure codes are defined in RFC 4120. If the ticket was malformed or damaged during transit and could not be decrypted, then many fields in this event might not be present. ",4824,"['Kerberos preauthentication by using DES or RC4 failed because the account was a member of the Protected User group.', 'Account Information:', 'Security ID:      %2', 'Account Name:     %1', 'Service Information:', 'Service Name:     %3', 'Network Information:', 'Client Address:     %7', 'Client Port:      %8', 'Additional Information:', 'Ticket Options:   %4', 'Failure Code:     %5', 'Pre-Authentication Type: %6', 'Certificate Information:', 'Certificate Issuer Name:   %9', 'Certificate Serial Number:  %10', 'Certificate Thumbprint:   %11']",(?P<Description>.*)\s+Account Information:(?:\s+|\S)Security ID:(?:\s+|\S)(?P<AccountInformationSecurityID>.*)\s+Account Name:(?:\s+|\S)(?P<AccountInformationAccountName>.*)\s+Service Information:(?:\s+|\S)Service Name:(?:\s+|\S)(?P<ServiceInformationServiceName>.*)\s+Network Information:(?:\s+|\S)Client Address:(?:\s+|\S)(?P<NetworkInformationClientAddress>.*)\s+Client Port:(?:\s+|\S)(?P<NetworkInformationClientPort>.*)\s+Additional Information:(?:\s+|\S)Ticket Options:(?:\s+|\S)(?P<AdditionalInformationTicketOptions>.*)\s+Failure Code:(?:\s+|\S)(?P<AdditionalInformationFailureCode>.*)\s+Pre-Authentication Type:(?:\s+|\S)(?P<AdditionalInformationPreAuthenticationType>.*)\s+Certificate Information:(?:\s+|\S)Certificate Issuer Name:(?:\s+|\S)(?P<CertificateInformationCertificateIssuerName>.*)\s+Certificate Serial Number:(?:\s+|\S)(?P<CertificateInformationCertificateSerialNumber>.*)\s+Certificate Thumbprint:(?:\s+|\S)(?P<CertificateInformationCertificateThumbprint>.*)
"{'Description': 'A user was denied the access to Remote Desktop. By default, users are allowed to connect only if they are members of the Remote Desktop Users group or Administrators group.', 'Subject': 'User Name: %1 Domain: %2 Logon ID: %3 Additional Information: Client Address: %4'}","A user was denied the access to Remote Desktop. By default, users are allowed to connect only if they are members of the Remote Desktop Users group or Administrators group. Subject: User Name: %1 Domain: %2 Logon ID: %3 Additional Information: Client Address: %4",4825,"['A user was denied the access to Remote. ', 'Subject:,User Name: %1,Domain: %2,Logon ID: %3,Additional Information:,Client Address: %4']",(?P<Description>.*)\s+Subject:(?:\s+|\S)(?P<Subject>.*)
"{'Description': 'Boot Configuration Data loaded. ', 'SubjectSID': 'SYSTEM', 'SubjectAccountName': '-', 'SubjectAccountDomain': '-', 'SubjectLogonID': '0x3E7', 'GeneralSettingsLoadOptions': '-', 'GeneralSettingsAdvancedOptions': 'No', 'GeneralSettingsConfigurationAccessPolicy': 'Default', 'GeneralSettingsSystemEventLogging': 'No', 'GeneralSettingsKernelDebugging': 'No', 'GeneralSettingsVSMLaunchType': 'Auto  ', 'SignatureSettingsTestSigning': 'No', 'SignatureSettingsFlightSigning': 'No', 'SignatureSettingsDisableIntegrityChecks': 'No ', 'HyperVisorSettingsHyperVisorLoadOptions': '-', 'HyperVisorSettingsHyperVisorLaunchType': 'Auto', 'HyperVisorSettingsHyperVisorDebugging': 'No '}",Boot Configuration Data loaded.  Subject: Security ID: SYSTEM Account Name: - Account Domain: - Logon ID: 0x3E7 General Settings: Load Options: - Advanced Options: No Configuration Access Policy: Default System Event Logging: No Kernel Debugging: No VSM Launch Type: Auto   Signature Settings:  Test Signing: No Flight Signing: No Disable Integrity Checks: No  HyperVisor Settings:  HyperVisor Load Options: - HyperVisor Launch Type: Auto HyperVisor Debugging: No ,4826,"['Boot Configuration Data loaded.', 'Subject:', 'Security ID: SYSTEM', 'Account Name: -', 'Account Domain: -', 'Logon ID: 0x3E7', 'General Settings:', 'Load Options: -', 'Advanced Options: No', 'Configuration Access Policy: Default', 'System Event Logging: No', 'Kernel Debugging: No', 'VSM Launch Type: Auto', 'Signature Settings:', ' Test Signing: No', 'Flight Signing: No', 'Disable Integrity Checks: No', 'HyperVisor Settings:', ' HyperVisor Load Options: -', 'HyperVisor Launch Type: Auto', 'HyperVisor Debugging: No']",(?P<Description>.*)\s+Subject:(?:\s+|\S)Security ID:(?:\s+|\S)(?P<SubjectSID>.*)\s+Account Name:(?:\s+|\S)(?P<SubjectAccountName>.*)\s+Account Domain:(?:\s+|\S)(?P<SubjectAccountDomain>.*)\s+Logon ID:(?:\s+|\S)(?P<SubjectLogonID>.*)\s+General Settings:(?:\s+|\S)Load Options:(?:\s+|\S)(?P<GeneralSettingsLoadOptions>.*)\s+Advanced Options:(?:\s+|\S)(?P<GeneralSettingsAdvancedOptions>.*)\s+Configuration Access Policy:(?:\s+|\S)(?P<GeneralSettingsConfigurationAccessPolicy>.*)\s+System Event Logging:(?:\s+|\S)(?P<GeneralSettingsSystemEventLogging>.*)\s+Kernel Debugging:(?:\s+|\S)(?P<GeneralSettingsKernelDebugging>.*)\s+VSM Launch Type:(?:\s+|\S)(?P<GeneralSettingsVSMLaunchType>.*)\s+Signature Settings:(?:\s+|\S) Test Signing:(?:\s+|\S)(?P<SignatureSettingsTestSigning>.*)\s+Flight Signing:(?:\s+|\S)(?P<SignatureSettingsFlightSigning>.*)\s+Disable Integrity Checks:(?:\s+|\S)(?P<SignatureSettingsDisableIntegrityChecks>.*)\s+HyperVisor Settings:(?:\s+|\S) HyperVisor Load Options:(?:\s+|\S)(?P<HyperVisorSettingsHyperVisorLoadOptions>.*)\s+HyperVisor Launch Type:(?:\s+|\S)(?P<HyperVisorSettingsHyperVisorLaunchType>.*)\s+HyperVisor Debugging:(?:\s+|\S)(?P<HyperVisorSettingsHyperVisorDebugging>.*)
"{'Description': 'SID History was removed from an account.', 'SubjectSID': '%6', 'SubjectAccountName': '%7', 'SubjectAccountDomain': '%8', 'SubjectLogonID': '%9', 'TargetAccountSecurityID': '%5', 'TargetAccountAccountName': '%3', 'TargetAccountAccountDomain': '%4 ', 'AdditionalInformationPrivileges': '%10', 'AdditionalInformationSIDList': '%11 '}",SID History was removed from an account. Subject:  Security ID: %6  Account Name: %7  Account Domain: %8  Logon ID: %9 Target Account:  Security ID: %5  Account Name: %3  Account Domain: %4  Additional Information:  Privileges: %10  SID List:  %11 ,4830,"['SID History was removed from an account.', 'Subject:', ' Security ID:%6', ' Account Name:%7', ' Account Domain:%8', ' Logon ID:%9', 'Target Account:', ' Security ID:%5', ' Account Name:%3', ' Account Domain:%4', 'Additional Information:', ' Privileges:%10', ' SID List:%11']",(?P<Description>.*)\s+Subject:(?:\s+|\S) Security ID:(?:\s+|\S)(?P<SubjectSID>.*)\s+ Account Name:(?:\s+|\S)(?P<SubjectAccountName>.*)\s+ Account Domain:(?:\s+|\S)(?P<SubjectAccountDomain>.*)\s+ Logon ID:(?:\s+|\S)(?P<SubjectLogonID>.*)\s+Target Account:(?:\s+|\S) Security ID:(?:\s+|\S)(?P<TargetAccountSecurityID>.*)\s+ Account Name:(?:\s+|\S)(?P<TargetAccountAccountName>.*)\s+ Account Domain:(?:\s+|\S)(?P<TargetAccountAccountDomain>.*)\s+Additional Information:(?:\s+|\S) Privileges:(?:\s+|\S)(?P<AdditionalInformationPrivileges>.*)\s+ SID List:(?:\s+|\S)(?P<AdditionalInformationSIDList>.*)
"{'Description': 'A namespace collision was detected.', 'TargetType': '%1', 'TargetName': '%2', 'ForestRoot': '%3', 'TopLevelName': '%4', 'DNSName': '%5', 'NetBIOSName': '%6', 'SecurityID': '%7', 'NewFlags': '%8 '}",A namespace collision was detected.  Target Type: %1 Target Name: %2 Forest Root: %3 Top Level Name: %4 DNS Name: %5 NetBIOS Name: %6 Security ID:  %7 New Flags: %8 ,4864,"['A namespace collision was detected.', ' Target Type: %1', 'Target Name: %2', 'Forest Root: %3', 'Top Level Name: %4', 'DNS Name: %5', 'NetBIOS Name: %6', 'Security ID:  %7', 'New Flags: %8']",(?P<Description>.*)\s+ Target Type:(?:\s+|\S)(?P<TargetType>.*)\s+Target Name:(?:\s+|\S)(?P<TargetName>.*)\s+Forest Root:(?:\s+|\S)(?P<ForestRoot>.*)\s+Top Level Name:(?:\s+|\S)(?P<TopLevelName>.*)\s+DNS Name:(?:\s+|\S)(?P<DNSName>.*)\s+NetBIOS Name:(?:\s+|\S)(?P<NetBIOSName>.*)\s+Security ID:(?:\s+|\S)(?P<SecurityID>.*)\s+New Flags:(?:\s+|\S)(?P<NewFlags>.*)
"{'Description': 'A trusted forest information entry was added.', 'SubjectSID': 'ACME-FR\\administrator', 'SubjectAccountName': 'administrator', 'SubjectAccountDomain': 'ACME-FR', 'SubjectLogonID': '0x20f9d', 'TrustInformationForestRoot': 'mtg.local', 'TrustInformationForestRootSID': 'MTG\\', 'TrustInformationOperationID': '0x3669eb', 'TrustInformationEntryType': '0', 'TrustInformationFlags': '0', 'TrustInformationTopLevelName': 'mtg.local', 'TrustInformationDNSName': '-', 'TrustInformationNetBIOSName': '-', 'TrustInformationDomainSID': 'NULL SID  '}",A trusted forest information entry was added. Subject:  Security ID:  ACME-FR\administrator Account Name:  administrator Account Domain:  ACME-FR Logon ID:  0x20f9d Trust Information:  Forest Root: mtg.local Forest Root SID: MTG\ Operation ID: 0x3669eb Entry Type: 0 Flags: 0 Top Level Name: mtg.local DNS Name: - NetBIOS Name: - Domain SID: NULL SID  ,4865,"['A trusted forest information entry was added.', 'Subject:', ' Security ID:  ACME-FR\\\\\\\\\\\\\\\\\\\\\\\\\\\\\\\\administrator', 'Account Name:  administrator', 'Account Domain:  ACME-FR', 'Logon ID:  0x20f9d', 'Trust Information:', ' Forest Root: mtg.local', 'Forest Root SID: MTG\\\\\\\\\\\\\\\\\\\\\\\\\\\\\\\\', 'Operation ID: 0x3669eb', 'Entry Type: 0', 'Flags: 0', 'Top Level Name: mtg.local', 'DNS Name: -', 'NetBIOS Name: -', 'Domain SID: NULL SID']",(?P<Description>.*)\s+Subject:(?:\s+|\S) Security ID:(?:\s+|\S)(?P<SubjectSID>.*)\s+Account Name:(?:\s+|\S)(?P<SubjectAccountName>.*)\s+Account Domain:(?:\s+|\S)(?P<SubjectAccountDomain>.*)\s+Logon ID:(?:\s+|\S)(?P<SubjectLogonID>.*)\s+Trust Information:(?:\s+|\S) Forest Root:(?:\s+|\S)(?P<TrustInformationForestRoot>.*)\s+Forest Root SID:(?:\s+|\S)(?P<TrustInformationForestRootSID>.*)\s+Operation ID:(?:\s+|\S)(?P<TrustInformationOperationID>.*)\s+Entry Type:(?:\s+|\S)(?P<TrustInformationEntryType>.*)\s+Flags:(?:\s+|\S)(?P<TrustInformationFlags>.*)\s+Top Level Name:(?:\s+|\S)(?P<TrustInformationTopLevelName>.*)\s+DNS Name:(?:\s+|\S)(?P<TrustInformationDNSName>.*)\s+NetBIOS Name:(?:\s+|\S)(?P<TrustInformationNetBIOSName>.*)\s+Domain SID:(?:\s+|\S)(?P<TrustInformationDomainSID>.*)
"{'Description': 'A trusted forest information entry was removed.', 'SubjectSID': 'ACME-FR\\administrator', 'SubjectAccountName': 'administrator', 'SubjectAccountDomain': 'ACME-FR', 'SubjectLogonID': '0x20f9d', 'TrustInformationForestRoot': 'mtg.local', 'TrustInformationForestRootSID': 'MTG\\', 'TrustInformationOperationID': '0x36d49c', 'TrustInformationEntryType': '1', 'TrustInformationFlags': '0', 'TrustInformationTopLevelName': 'junk.mtg.local', 'TrustInformationDNSName': '-', 'TrustInformationNetBIOSName': '-', 'TrustInformationDomainSID': 'NULL SID  '}",A trusted forest information entry was removed. Subject:  Security ID:  ACME-FR\administrator Account Name:  administrator Account Domain:  ACME-FR Logon ID:  0x20f9d Trust Information:  Forest Root: mtg.local Forest Root SID: MTG\ Operation ID: 0x36d49c Entry Type: 1 Flags: 0 Top Level Name: junk.mtg.local DNS Name: - NetBIOS Name: - Domain SID: NULL SID  ,4866,"['A trusted forest information entry was removed.', 'Subject:', ' Security ID:  ACME-FR\\\\\\\\\\\\\\\\\\\\\\\\\\\\\\\\administrator', 'Account Name:  administrator', 'Account Domain:  ACME-FR', 'Logon ID:  0x20f9d', 'Trust Information:', ' Forest Root: mtg.local', 'Forest Root SID: MTG\\\\\\\\\\\\\\\\\\\\\\\\\\\\\\\\', 'Operation ID: 0x36d49c', 'Entry Type: 1', 'Flags: 0', 'Top Level Name: junk.mtg.local', 'DNS Name: -', 'NetBIOS Name: -', 'Domain SID: NULL SID']",(?P<Description>.*)\s+Subject:(?:\s+|\S) Security ID:(?:\s+|\S)(?P<SubjectSID>.*)\s+Account Name:(?:\s+|\S)(?P<SubjectAccountName>.*)\s+Account Domain:(?:\s+|\S)(?P<SubjectAccountDomain>.*)\s+Logon ID:(?:\s+|\S)(?P<SubjectLogonID>.*)\s+Trust Information:(?:\s+|\S) Forest Root:(?:\s+|\S)(?P<TrustInformationForestRoot>.*)\s+Forest Root SID:(?:\s+|\S)(?P<TrustInformationForestRootSID>.*)\s+Operation ID:(?:\s+|\S)(?P<TrustInformationOperationID>.*)\s+Entry Type:(?:\s+|\S)(?P<TrustInformationEntryType>.*)\s+Flags:(?:\s+|\S)(?P<TrustInformationFlags>.*)\s+Top Level Name:(?:\s+|\S)(?P<TrustInformationTopLevelName>.*)\s+DNS Name:(?:\s+|\S)(?P<TrustInformationDNSName>.*)\s+NetBIOS Name:(?:\s+|\S)(?P<TrustInformationNetBIOSName>.*)\s+Domain SID:(?:\s+|\S)(?P<TrustInformationDomainSID>.*)
